,number,value,datetime_start,datetime_complete,duration,params_C,params_class_weight,params_max_iter,params_penalty,params_tol,state
0,0,0.9987504405498061,2025-04-28 17:02:59.864423,2025-04-28 17:03:02.949283,0 days 00:00:03.084860,0.0017525910408553158,,300,l1,0.0007494038999553293,COMPLETE
1,1,0.9993918248455556,2025-04-28 17:03:02.949672,2025-04-28 17:03:04.343892,0 days 00:00:01.394220,6.364691591890874,balanced,100,l1,0.00789951766337853,COMPLETE
2,2,0.999167733674776,2025-04-28 17:03:04.344308,2025-04-28 17:03:23.009267,0 days 00:00:18.664959,800.9523363396817,balanced,1000,l2,0.00011389198685040398,COMPLETE
3,3,0.998624396173902,2025-04-28 17:03:23.009605,2025-04-28 17:03:25.315969,0 days 00:00:02.306364,4.77066332915497,,900,l1,0.00013623093147462716,COMPLETE
4,4,0.999327720331658,2025-04-28 17:03:25.316292,2025-04-28 17:03:29.447199,0 days 00:00:04.130907,516.3070856440853,balanced,700,l2,0.010852432694645022,COMPLETE
5,5,0.9991358064206382,2025-04-28 17:03:29.447527,2025-04-28 17:03:33.768220,0 days 00:00:04.320693,902.1937964429568,balanced,600,l2,0.0019406498736849614,COMPLETE
6,6,0.9992314589470987,2025-04-28 17:03:33.768540,2025-04-28 17:03:39.429452,0 days 00:00:05.660912,30.295426931475113,,800,l2,0.00023441230303766162,COMPLETE
7,7,0.9982091461464663,2025-04-28 17:03:39.429788,2025-04-28 17:03:42.254819,0 days 00:00:02.825031,96.53968880484967,balanced,200,l1,0.0001190713354790583,COMPLETE
8,8,0.9992314589470987,2025-04-28 17:03:42.255143,2025-04-28 17:03:47.000324,0 days 00:00:04.745181,0.013638858742783542,,600,l2,0.004242939189422658,COMPLETE
9,9,0.99862422012478,2025-04-28 17:03:47.000667,2025-04-28 17:03:49.010431,0 days 00:00:02.009764,46.66124717750055,,100,l1,0.00015286135308362526,COMPLETE
10,10,0.9974112307839815,2025-04-28 17:03:49.010738,2025-04-28 17:03:50.313151,0 days 00:00:01.302413,0.14659550910791383,balanced,400,l1,0.0993243987143168,COMPLETE
11,11,0.9992956844666411,2025-04-28 17:03:50.313479,2025-04-28 17:03:54.006295,0 days 00:00:03.692816,1.4316244806488911,balanced,700,l2,0.017082149187546268,COMPLETE
12,12,0.9992637408367745,2025-04-28 17:03:54.006636,2025-04-28 17:03:55.366339,0 days 00:00:01.359703,0.2535005516566699,balanced,400,l1,0.013811294813126939,COMPLETE
13,13,0.9992956844666411,2025-04-28 17:03:55.366677,2025-04-28 17:03:58.883372,0 days 00:00:03.516695,7.25077158288588,balanced,500,l2,0.014220293786372218,COMPLETE
14,14,0.998368887325295,2025-04-28 17:03:58.883723,2025-04-28 17:04:00.226964,0 days 00:00:01.343241,222.29966072707978,balanced,100,l1,0.03931715559104118,COMPLETE
15,15,0.9992637879709356,2025-04-28 17:04:00.227305,2025-04-28 17:04:04.452200,0 days 00:00:04.224895,10.304442961962504,balanced,800,l2,0.0038310321804749707,COMPLETE
16,16,0.9992317049747103,2025-04-28 17:04:04.452534,2025-04-28 17:04:05.815063,0 days 00:00:01.362529,0.6535558533829162,balanced,700,l1,0.0061842897103937455,COMPLETE
17,17,0.9991678402253233,2025-04-28 17:04:05.815394,2025-04-28 17:04:10.873929,0 days 00:00:05.058535,216.97009969538365,balanced,300,l2,0.0015674422941809865,COMPLETE
18,18,0.9992956844666411,2025-04-28 17:04:10.874273,2025-04-28 17:04:14.308394,0 days 00:00:03.434121,0.07924454704100646,balanced,500,l2,0.03718455376488097,COMPLETE
19,19,0.9991678402253233,2025-04-28 17:04:14.308714,2025-04-28 17:04:15.667684,0 days 00:00:01.358970,2.0850417732082507,balanced,1000,l1,0.007923669630166753,COMPLETE
20,20,0.9990078412546007,2025-04-28 17:04:15.668027,2025-04-28 17:04:19.966962,0 days 00:00:04.298935,0.027578669831528013,balanced,700,l2,0.0004539570782944417,COMPLETE
21,21,0.9992956844666411,2025-04-28 17:04:19.967297,2025-04-28 17:04:23.748621,0 days 00:00:03.781324,0.9256739748546036,balanced,700,l2,0.017475705372276266,COMPLETE
22,22,0.9992956844666411,2025-04-28 17:04:23.749135,2025-04-28 17:04:27.090879,0 days 00:00:03.341744,21.725267736992674,balanced,800,l2,0.03422609070249154,COMPLETE
23,23,0.9991358617378779,2025-04-28 17:04:27.091206,2025-04-28 17:04:31.150020,0 days 00:00:04.058814,3.280728129476739,balanced,600,l2,0.0079360004492623,COMPLETE
24,24,0.9992956844666411,2025-04-28 17:04:31.150338,2025-04-28 17:04:34.348198,0 days 00:00:03.197860,0.46409536926383194,balanced,900,l2,0.023534740714366478,COMPLETE
25,25,0.9954797550732537,2025-04-28 17:04:34.348540,2025-04-28 17:04:36.737180,0 days 00:00:02.388640,1.3157590324549513,balanced,700,l2,0.07627220772509337,COMPLETE
26,26,0.9992316065825702,2025-04-28 17:04:36.737501,2025-04-28 17:04:38.110722,0 days 00:00:01.373221,204.2678607973708,,400,l1,0.0018347319949580294,COMPLETE
27,27,0.9992956844666411,2025-04-28 17:04:38.111048,2025-04-28 17:04:41.776151,0 days 00:00:03.665103,12.579502016061383,balanced,500,l2,0.01044741623047071,COMPLETE
28,28,0.9992317049747103,2025-04-28 17:04:41.776470,2025-04-28 17:04:43.087074,0 days 00:00:01.310604,75.29440392234122,balanced,900,l1,0.023589992033498267,COMPLETE
29,29,0.9991673605328893,2025-04-28 17:04:43.087414,2025-04-28 17:04:46.681281,0 days 00:00:03.593867,0.007283450825467851,,200,l1,0.0009212194649329925,COMPLETE
30,30,0.9992956844666411,2025-04-28 17:04:46.681615,2025-04-28 17:04:52.355674,0 days 00:00:05.674059,0.001396357862861622,balanced,300,l2,0.0053677264347039115,COMPLETE
31,31,0.9992956844666411,2025-04-28 17:04:52.356147,2025-04-28 17:04:57.074187,0 days 00:00:04.718040,6.080364146773504,balanced,500,l2,0.013190479471794378,COMPLETE
32,32,0.9989440337909188,2025-04-28 17:04:57.074605,2025-04-28 17:05:03.269287,0 days 00:00:06.194682,2.006722862436667,balanced,200,l2,0.0027679257800923606,COMPLETE
33,33,0.9992956844666411,2025-04-28 17:05:03.269677,2025-04-28 17:05:07.328603,0 days 00:00:04.058926,7.68629915999948,balanced,800,l2,0.020052856141052774,COMPLETE
34,34,0.9980171421261352,2025-04-28 17:05:07.328973,2025-04-28 17:05:10.532795,0 days 00:00:03.203822,17.743142661190646,balanced,600,l2,0.05433749489308744,COMPLETE
35,35,0.9992636465503442,2025-04-28 17:05:10.533141,2025-04-28 17:05:14.964224,0 days 00:00:04.431083,979.7907777592909,balanced,700,l2,0.009714064801597746,COMPLETE
36,36,0.9992314589470987,2025-04-28 17:05:14.964654,2025-04-28 17:05:19.125131,0 days 00:00:04.160477,438.1600726645827,,900,l2,0.0030324052827788196,COMPLETE
37,37,0.9992956844666411,2025-04-28 17:05:19.125465,2025-04-28 17:05:22.410125,0 days 00:00:03.284660,3.960797967184012,balanced,500,l2,0.014093433460856553,COMPLETE
38,38,0.9991675204918034,2025-04-28 17:05:22.410452,2025-04-28 17:05:23.735924,0 days 00:00:01.325472,0.3536016145642419,,600,l1,0.004943130798282063,COMPLETE
39,39,0.9992956844666411,2025-04-28 17:05:23.736255,2025-04-28 17:05:26.931133,0 days 00:00:03.194878,54.08558697046273,balanced,800,l2,0.030540781869220487,COMPLETE
40,40,0.9988482948365219,2025-04-28 17:05:26.931467,2025-04-28 17:05:28.256392,0 days 00:00:01.324925,0.08213228409887682,balanced,100,l1,0.053376156716854174,COMPLETE
41,41,0.9980171421261352,2025-04-28 17:05:28.256733,2025-04-28 17:05:32.300960,0 days 00:00:04.044227,0.04666362049968765,balanced,400,l2,0.04594071890113385,COMPLETE
42,42,0.9979849672157365,2025-04-28 17:05:32.301395,2025-04-28 17:05:36.090674,0 days 00:00:03.789279,0.0030739697440186823,balanced,500,l2,0.02714485201085129,COMPLETE
43,43,0.9992636465503442,2025-04-28 17:05:36.091039,2025-04-28 17:05:41.095752,0 days 00:00:05.004713,0.250227938735064,balanced,600,l2,0.016461966432373642,COMPLETE
44,44,0.9992956844666411,2025-04-28 17:05:41.096121,2025-04-28 17:05:45.905084,0 days 00:00:04.808963,0.11103985712417098,balanced,200,l2,0.011317785747097969,COMPLETE
45,45,0.999327720331658,2025-04-28 17:05:45.905433,2025-04-28 17:05:50.546175,0 days 00:00:04.640742,34.2498474546104,balanced,500,l2,0.007321017032603252,COMPLETE
46,46,0.9992315573770492,2025-04-28 17:05:50.546594,2025-04-28 17:05:51.907188,0 days 00:00:01.360594,35.250985995890844,,300,l1,0.006853557914931541,COMPLETE
47,47,0.999327720331658,2025-04-28 17:05:51.907512,2025-04-28 17:05:56.045462,0 days 00:00:04.137950,393.40178763859507,balanced,1000,l2,0.009512696284211173,COMPLETE
48,48,0.9992636465503442,2025-04-28 17:05:56.045858,2025-04-28 17:06:00.211191,0 days 00:00:04.165333,131.76193539789594,balanced,1000,l2,0.003795891548166809,COMPLETE
49,49,0.9991997695336257,2025-04-28 17:06:00.211564,2025-04-28 17:06:01.611422,0 days 00:00:01.399858,456.3909447273598,balanced,1000,l1,0.0022868508116689794,COMPLETE
50,50,0.9992956844666411,2025-04-28 17:06:01.611770,2025-04-28 17:06:05.322041,0 days 00:00:03.710271,423.9704743250003,balanced,400,l2,0.007942769070904465,COMPLETE
51,51,0.9992956844666411,2025-04-28 17:06:05.322375,2025-04-28 17:06:09.147899,0 days 00:00:03.825524,102.66060320275004,balanced,900,l2,0.009653769646742348,COMPLETE
52,52,0.9992636465503442,2025-04-28 17:06:09.148243,2025-04-28 17:06:13.408092,0 days 00:00:04.259849,2.273332257534149,balanced,700,l2,0.005871880251439058,COMPLETE
53,53,0.9992956844666411,2025-04-28 17:06:13.408437,2025-04-28 17:06:16.825336,0 days 00:00:03.416899,20.62949150691967,balanced,400,l2,0.017102590501007032,COMPLETE
54,54,0.9992636465503442,2025-04-28 17:06:16.825683,2025-04-28 17:06:21.134952,0 days 00:00:04.309269,11.235903851318222,balanced,300,l2,0.0043980077457340064,COMPLETE
55,55,0.9992956844666411,2025-04-28 17:06:21.135302,2025-04-28 17:06:24.837127,0 days 00:00:03.701825,40.714190104481645,balanced,600,l2,0.012840860468254087,COMPLETE
56,56,0.9992958197298508,2025-04-28 17:06:24.837473,2025-04-28 17:06:26.228923,0 days 00:00:01.391450,1.0497726778844552,balanced,800,l1,0.007595868065237643,COMPLETE
57,57,0.9993278494382741,2025-04-28 17:06:26.229455,2025-04-28 17:06:27.589787,0 days 00:00:01.360332,1.0504653024732322,balanced,800,l1,0.007750133957861015,COMPLETE
58,58,0.998912,2025-04-28 17:06:27.590139,2025-04-28 17:06:29.053840,0 days 00:00:01.463701,0.8000057759244652,balanced,800,l1,0.0012507127170723626,COMPLETE
59,59,0.9992955491514569,2025-04-28 17:06:29.054176,2025-04-28 17:06:30.374660,0 days 00:00:01.320484,647.0484726741826,,900,l1,0.00795606250411381,COMPLETE
60,60,0.9992957295601511,2025-04-28 17:06:30.374997,2025-04-28 17:06:31.738304,0 days 00:00:01.363307,144.9349472822059,balanced,800,l1,0.003738299098865011,COMPLETE
61,61,0.999231852515683,2025-04-28 17:06:31.738650,2025-04-28 17:06:33.116832,0 days 00:00:01.378182,183.53280415720795,balanced,800,l1,0.00381601617212361,COMPLETE
62,62,0.9991677869534601,2025-04-28 17:06:33.117182,2025-04-28 17:06:34.481366,0 days 00:00:01.364184,328.640230728789,balanced,1000,l1,0.006833574659337975,COMPLETE
63,63,0.9991357510963157,2025-04-28 17:06:34.481710,2025-04-28 17:06:35.853608,0 days 00:00:01.371898,63.59634477464616,balanced,800,l1,0.005839091313473409,COMPLETE
64,64,0.9991677869534601,2025-04-28 17:06:35.853949,2025-04-28 17:06:37.197133,0 days 00:00:01.343184,131.72919105514936,balanced,900,l1,0.00925924482769091,COMPLETE
65,65,0.9992318033416555,2025-04-28 17:06:37.197474,2025-04-28 17:06:38.578356,0 days 00:00:01.380882,270.8713977829122,balanced,700,l1,0.0024305807359875,COMPLETE
66,66,0.9992636936965777,2025-04-28 17:06:38.578715,2025-04-28 17:06:39.946563,0 days 00:00:01.367848,670.4124396691968,balanced,800,l1,0.004767810215404658,COMPLETE
67,67,0.9991358064206382,2025-04-28 17:06:39.946916,2025-04-28 17:06:41.331288,0 days 00:00:01.384372,152.1688906737322,balanced,900,l1,0.0037585356171574453,COMPLETE
68,68,0.9992957746478872,2025-04-28 17:06:41.331661,2025-04-28 17:06:42.714075,0 days 00:00:01.382414,1.4317444831510668,balanced,700,l1,0.006971552573097083,COMPLETE
69,69,0.9988161894096944,2025-04-28 17:06:42.714428,2025-04-28 17:06:44.431036,0 days 00:00:01.716608,1.2602645536806536,balanced,700,l1,0.0004565009908987817,COMPLETE
70,70,0.999167733674776,2025-04-28 17:06:44.431388,2025-04-28 17:06:45.792486,0 days 00:00:01.361098,2.9520963888963356,balanced,700,l1,0.011768513135294098,COMPLETE
71,71,0.9992957746478872,2025-04-28 17:06:45.792839,2025-04-28 17:06:47.158710,0 days 00:00:01.365871,0.37788762540564896,balanced,800,l1,0.006845138256351201,COMPLETE
72,72,0.9992957746478872,2025-04-28 17:06:47.159055,2025-04-28 17:06:48.532255,0 days 00:00:01.373200,0.20979903844552442,balanced,800,l1,0.006943974884786369,COMPLETE
73,73,0.9991359170480366,2025-04-28 17:06:48.532612,2025-04-28 17:06:49.897275,0 days 00:00:01.364663,5.5876321195080365,balanced,700,l1,0.008244316554386786,COMPLETE
74,74,0.9991997695336257,2025-04-28 17:06:49.897624,2025-04-28 17:06:51.261172,0 days 00:00:01.363548,0.5327865005119735,balanced,900,l1,0.005471489294217046,COMPLETE
75,75,0.9992957295601511,2025-04-28 17:06:51.261521,2025-04-28 17:06:52.601977,0 days 00:00:01.340456,0.38926750811336436,balanced,800,l1,0.02314587063666465,COMPLETE
76,76,0.9991994620384897,2025-04-28 17:06:52.602327,2025-04-28 17:06:53.936332,0 days 00:00:01.334005,0.7238212927568326,,700,l1,0.010772007377448737,COMPLETE
77,77,0.9992957295601511,2025-04-28 17:06:53.936685,2025-04-28 17:06:55.283592,0 days 00:00:01.346907,1.5386385648412266,balanced,600,l1,0.014588231604706658,COMPLETE
78,78,0.999167733674776,2025-04-28 17:06:55.283952,2025-04-28 17:06:56.632010,0 days 00:00:01.348058,0.15381287005682193,balanced,900,l1,0.020271562297138765,COMPLETE
79,79,0.9992318033416555,2025-04-28 17:06:56.632365,2025-04-28 17:06:57.999344,0 days 00:00:01.366979,1.0764905427426745,balanced,1000,l1,0.009182344655892023,COMPLETE
80,80,0.9992638350990621,2025-04-28 17:06:57.999711,2025-04-28 17:06:59.373516,0 days 00:00:01.373805,8.206631726641962,balanced,100,l1,0.003114069561834056,COMPLETE
81,81,0.9993278064082456,2025-04-28 17:06:59.373863,2025-04-28 17:07:00.740694,0 days 00:00:01.366831,0.21753010256892116,balanced,800,l1,0.006980973868765631,COMPLETE
82,82,0.9991997695336257,2025-04-28 17:07:00.741052,2025-04-28 17:07:02.132959,0 days 00:00:01.391907,0.33178064755837083,balanced,800,l1,0.006615295737913039,COMPLETE
83,83,0.9992637408367745,2025-04-28 17:07:02.133306,2025-04-28 17:07:03.520123,0 days 00:00:01.386817,0.5543939347024217,balanced,800,l1,0.005303068691179978,COMPLETE
84,84,0.9992957746478872,2025-04-28 17:07:03.520482,2025-04-28 17:07:04.882209,0 days 00:00:01.361727,4.283996926008604,balanced,700,l1,0.011820649740207073,COMPLETE
85,85,0.9992636936965777,2025-04-28 17:07:04.882562,2025-04-28 17:07:06.247023,0 days 00:00:01.364461,1.7772455528371323,balanced,600,l1,0.008810709536204595,COMPLETE
86,86,0.9993277633727072,2025-04-28 17:07:06.247383,2025-04-28 17:07:07.615046,0 days 00:00:01.367663,0.9275286342983708,balanced,700,l1,0.014761747481916082,COMPLETE
87,87,0.9991995645631223,2025-04-28 17:07:07.615391,2025-04-28 17:07:08.942751,0 days 00:00:01.327360,2.9858054816417368,,700,l1,0.014828317960113304,COMPLETE
88,88,0.9992956844666411,2025-04-28 17:07:08.943096,2025-04-28 17:07:12.000366,0 days 00:00:03.057270,15.47885290695217,balanced,600,l2,0.018172100997010558,COMPLETE
89,89,0.9992319016834155,2025-04-28 17:07:12.000724,2025-04-28 17:07:13.329209,0 days 00:00:01.328485,27.801621748410966,balanced,500,l1,0.010473395998145353,COMPLETE
90,90,0.9992956844666411,2025-04-28 17:07:13.329545,2025-04-28 17:07:16.383556,0 days 00:00:03.054011,0.9995856226763016,balanced,200,l2,0.013159460321642013,COMPLETE
91,91,0.9993598361180462,2025-04-28 17:07:16.383899,2025-04-28 17:07:17.716339,0 days 00:00:01.332440,0.26770185127076274,balanced,800,l1,0.006811800086819231,COMPLETE
92,92,0.9992637408367745,2025-04-28 17:07:17.716888,2025-04-28 17:07:19.073418,0 days 00:00:01.356530,0.1871496419230602,balanced,700,l1,0.004565732676734248,COMPLETE
93,93,0.9992318033416555,2025-04-28 17:07:19.073757,2025-04-28 17:07:20.432754,0 days 00:00:01.358997,0.048150494150346855,balanced,800,l1,0.0075155257755696704,COMPLETE
94,94,0.9992637408367745,2025-04-28 17:07:20.433115,2025-04-28 17:07:21.799644,0 days 00:00:01.366529,0.0927240169657045,balanced,900,l1,0.005931038408179671,COMPLETE
95,95,0.9992957746478872,2025-04-28 17:07:21.799988,2025-04-28 17:07:23.144032,0 days 00:00:01.344044,0.05516198004951163,balanced,700,l1,0.010656258475249992,COMPLETE
96,96,0.9990079047588569,2025-04-28 17:07:23.144368,2025-04-28 17:07:24.468364,0 days 00:00:01.323996,0.6709330796385584,balanced,900,l1,0.008468368773797318,COMPLETE
97,97,0.9992956844666411,2025-04-28 17:07:24.468702,2025-04-28 17:07:27.954867,0 days 00:00:03.486165,2.414154154758227,balanced,1000,l2,0.004508457958876927,COMPLETE
98,98,0.999327720331658,2025-04-28 17:07:27.955218,2025-04-28 17:07:29.294270,0 days 00:00:01.339052,0.024293307659063103,balanced,800,l1,0.015758272618412963,COMPLETE
99,99,0.9993277633727072,2025-04-28 17:07:29.294602,2025-04-28 17:07:42.747535,0 days 00:00:13.452933,0.011940967397141587,balanced,800,l2,0.00010004241532517279,COMPLETE
