,number,value,datetime_start,datetime_complete,duration,params_C,params_class_weight,params_max_iter,params_penalty,params_tol,state
0,0,0.2829736211031175,2025-04-25 15:32:25.764083,2025-04-25 15:32:25.989531,0 days 00:00:00.225448,0.007679577486528099,balanced,100,l2,0.007720181714291409,COMPLETE
1,1,0.5283018867924528,2025-04-25 15:32:25.989981,2025-04-25 15:32:26.516286,0 days 00:00:00.526305,0.8514727242543689,,300,l2,0.00023654100390946436,COMPLETE
2,2,0.5308641975308641,2025-04-25 15:32:26.516597,2025-04-25 15:32:27.103493,0 days 00:00:00.586896,0.10078702373049143,,600,l2,0.0028633928482089174,COMPLETE
3,3,0.29890643985419196,2025-04-25 15:32:27.103889,2025-04-25 15:32:27.197864,0 days 00:00:00.093975,74.81049182488988,balanced,300,l1,0.007265882852343865,COMPLETE
4,4,0.30886075949367087,2025-04-25 15:32:27.198189,2025-04-25 15:32:27.792279,0 days 00:00:00.594090,122.68565904249938,balanced,500,l2,0.0005218710342595722,COMPLETE
5,5,0.3044554455445544,2025-04-25 15:32:27.792590,2025-04-25 15:32:27.886614,0 days 00:00:00.094024,3.3664603283144596,balanced,400,l1,0.017949249847164908,COMPLETE
6,6,0.4724919093851132,2025-04-25 15:32:27.886995,2025-04-25 15:32:28.111429,0 days 00:00:00.224434,0.11379361547711328,,100,l2,0.00012209454614308808,COMPLETE
7,7,0.25055432372505543,2025-04-25 15:32:28.111746,2025-04-25 15:32:28.193380,0 days 00:00:00.081634,40.98114509208977,balanced,300,l1,0.07657410576483858,COMPLETE
8,8,0.28848484848484846,2025-04-25 15:32:28.193710,2025-04-25 15:32:28.421582,0 days 00:00:00.227872,0.09982858775282537,balanced,600,l2,0.003985556224858236,COMPLETE
9,9,0.2659217877094972,2025-04-25 15:32:28.421924,2025-04-25 15:32:28.504444,0 days 00:00:00.082520,266.9782729513924,balanced,800,l1,0.030746974126774303,COMPLETE
10,10,0.5525525525525525,2025-04-25 15:32:28.504766,2025-04-25 15:32:29.527462,0 days 00:00:01.022696,0.0035844908355599455,,900,l2,0.0008632642234312248,COMPLETE
11,11,0.5308641975308641,2025-04-25 15:32:29.527790,2025-04-25 15:32:30.328075,0 days 00:00:00.800285,0.0012979331210486182,,1000,l2,0.0009028377368271184,COMPLETE
12,12,0.5481927710843373,2025-04-25 15:32:30.328411,2025-04-25 15:32:31.033049,0 days 00:00:00.704638,0.016236869963298355,,800,l2,0.0014603605286181661,COMPLETE
13,13,0.5171339563862929,2025-04-25 15:32:31.033378,2025-04-25 15:32:31.746518,0 days 00:00:00.713140,0.0010309080354317397,,900,l2,0.0013233362979908974,COMPLETE
14,14,0.5847953216374269,2025-04-25 15:32:31.746846,2025-04-25 15:32:33.109021,0 days 00:00:01.362175,0.010624538363909088,,800,l2,0.0004367411496880597,COMPLETE
15,15,0.5847953216374269,2025-04-25 15:32:33.109342,2025-04-25 15:32:33.970390,0 days 00:00:00.861048,0.00809130873485579,,800,l2,0.00037485923969105266,COMPLETE
16,16,0.5847953216374269,2025-04-25 15:32:33.970724,2025-04-25 15:32:35.038145,0 days 00:00:01.067421,0.026073825678540153,,700,l2,0.0003077099003558059,COMPLETE
17,17,0.5398773006134969,2025-04-25 15:32:35.038494,2025-04-25 15:32:36.109890,0 days 00:00:01.071396,0.6403239543195813,,1000,l2,0.00010368825283636617,COMPLETE
18,18,0.5764705882352941,2025-04-25 15:32:36.110237,2025-04-25 15:32:36.229173,0 days 00:00:00.118936,14.283710095472507,,700,l1,0.0003260310439609648,COMPLETE
19,19,0.5398773006134969,2025-04-25 15:32:36.229506,2025-04-25 15:32:37.022095,0 days 00:00:00.792589,0.036864269459606885,,800,l2,0.00021925037748835366,COMPLETE
20,20,0.5525525525525525,2025-04-25 15:32:37.022433,2025-04-25 15:32:37.982064,0 days 00:00:00.959631,0.3248068942184512,,700,l2,0.0006081269594265,COMPLETE
21,21,0.5611940298507462,2025-04-25 15:32:37.982417,2025-04-25 15:32:39.072028,0 days 00:00:01.089611,0.016006133688139617,,700,l2,0.0002972432854725417,COMPLETE
22,22,0.5847953216374269,2025-04-25 15:32:39.072366,2025-04-25 15:32:40.246097,0 days 00:00:01.173731,0.005893203351820569,,900,l2,0.0004044558389445296,COMPLETE
23,23,0.5531914893617021,2025-04-25 15:32:40.246581,2025-04-25 15:32:40.995045,0 days 00:00:00.748464,0.030468105056288265,,500,l2,0.00017001775412843562,COMPLETE
24,24,0.5353846153846155,2025-04-25 15:32:40.995372,2025-04-25 15:32:41.646081,0 days 00:00:00.650709,0.0028796148324596693,,700,l2,0.0019355290384849432,COMPLETE
25,25,0.5398773006134969,2025-04-25 15:32:41.646414,2025-04-25 15:32:42.680531,0 days 00:00:01.034117,2.2566417483840606,,800,l2,0.0007278482158441802,COMPLETE
26,26,0.5398773006134969,2025-04-25 15:32:42.680865,2025-04-25 15:32:43.587982,0 days 00:00:00.907117,0.2249092403237766,,600,l2,0.00016845756438366248,COMPLETE
27,27,0.6617647058823529,2025-04-25 15:32:43.588410,2025-04-25 15:32:43.746191,0 days 00:00:00.157781,0.023299612054359476,,900,l1,0.000492855601932241,COMPLETE
28,28,0.6356589147286822,2025-04-25 15:32:43.746545,2025-04-25 15:32:43.872870,0 days 00:00:00.126325,0.009023430291805756,,1000,l1,0.0011761565099987382,COMPLETE
29,29,0.5515320334261838,2025-04-25 15:32:43.873212,2025-04-25 15:32:43.967570,0 days 00:00:00.094358,808.5993252698413,,1000,l1,0.004710050867722567,COMPLETE
30,30,0.5994065281899109,2025-04-25 15:32:43.967897,2025-04-25 15:32:44.085458,0 days 00:00:00.117561,0.05226990789494677,,900,l1,0.002241230783551152,COMPLETE
31,31,0.5714285714285714,2025-04-25 15:32:44.085790,2025-04-25 15:32:44.208487,0 days 00:00:00.122697,0.060976087628021286,,900,l1,0.0023023054217027297,COMPLETE
32,32,0.648854961832061,2025-04-25 15:32:44.208818,2025-04-25 15:32:44.341181,0 days 00:00:00.132363,0.01006838481676708,,1000,l1,0.0010076778726703138,COMPLETE
33,33,0.6198347107438017,2025-04-25 15:32:44.341512,2025-04-25 15:32:44.472333,0 days 00:00:00.130821,0.003261160590294252,,1000,l1,0.0010914775965655424,COMPLETE
34,34,0.5726495726495726,2025-04-25 15:32:44.472655,2025-04-25 15:32:44.614830,0 days 00:00:00.142175,0.0026393157671718093,,1000,l1,0.0014380660329019383,COMPLETE
35,35,0.6000000000000001,2025-04-25 15:32:44.615193,2025-04-25 15:32:44.769260,0 days 00:00:00.154067,0.006031296889118547,,1000,l1,0.001062365970916974,COMPLETE
36,36,0.30459770114942525,2025-04-25 15:32:44.769611,2025-04-25 15:32:44.871175,0 days 00:00:00.101564,0.0020376739643071557,balanced,1000,l1,0.008569522673025203,COMPLETE
37,37,0.6564885496183207,2025-04-25 15:32:44.871522,2025-04-25 15:32:45.027221,0 days 00:00:00.155699,0.014854629322641437,,900,l1,0.0006934388807093185,COMPLETE
38,38,0.30363864491844417,2025-04-25 15:32:45.027565,2025-04-25 15:32:45.153075,0 days 00:00:00.125510,0.2600796799962704,balanced,900,l1,0.0005209449128951116,COMPLETE
39,39,0.6590038314176245,2025-04-25 15:32:45.153410,2025-04-25 15:32:45.262758,0 days 00:00:00.109348,0.016827915073550134,,100,l1,0.003905886947968279,COMPLETE
40,40,0.30925221799746516,2025-04-25 15:32:45.263132,2025-04-25 15:32:45.363863,0 days 00:00:00.100731,0.07277664901738706,balanced,100,l1,0.0074597462714669684,COMPLETE
41,41,0.6590038314176245,2025-04-25 15:32:45.364231,2025-04-25 15:32:45.484122,0 days 00:00:00.119891,0.018759957561702744,,200,l1,0.0040110445374233975,COMPLETE
42,42,0.6590038314176245,2025-04-25 15:32:45.484450,2025-04-25 15:32:45.595485,0 days 00:00:00.111035,0.019579781299978956,,200,l1,0.003742582572486367,COMPLETE
43,43,0.5606936416184971,2025-04-25 15:32:45.595821,2025-04-25 15:32:45.693365,0 days 00:00:00.097544,0.1340827732078139,,200,l1,0.010606673424110242,COMPLETE
44,44,0.6870229007633588,2025-04-25 15:32:45.693717,2025-04-25 15:32:45.796275,0 days 00:00:00.102558,0.023870374929606163,,200,l1,0.00446913094579992,COMPLETE
45,45,0.5535714285714285,2025-04-25 15:32:45.796639,2025-04-25 15:32:45.902284,0 days 00:00:00.105645,0.034082712274901894,,200,l1,0.00368797879962828,COMPLETE
46,46,0.553314121037464,2025-04-25 15:32:45.902665,2025-04-25 15:32:46.000163,0 days 00:00:00.097498,0.6613450316876149,,200,l1,0.015168738784736624,COMPLETE
47,47,0.30402010050251255,2025-04-25 15:32:46.000528,2025-04-25 15:32:46.100486,0 days 00:00:00.099958,0.14091137295827735,balanced,400,l1,0.005566379787761676,COMPLETE
48,48,0.6742424242424243,2025-04-25 15:32:46.100824,2025-04-25 15:32:46.210153,0 days 00:00:00.109329,0.02101421587735466,,100,l1,0.002990869756768445,COMPLETE
49,49,0.6215384615384615,2025-04-25 15:32:46.210495,2025-04-25 15:32:46.301395,0 days 00:00:00.090900,1.5869261759212794,,100,l1,0.028360907622770815,COMPLETE
50,50,0.556179775280899,2025-04-25 15:32:46.301733,2025-04-25 15:32:46.393988,0 days 00:00:00.092255,6.48494730467029,,300,l1,0.0029925628658020037,COMPLETE
51,51,0.6768060836501901,2025-04-25 15:32:46.394348,2025-04-25 15:32:46.496355,0 days 00:00:00.102007,0.02122713326279346,,100,l1,0.005142177461218059,COMPLETE
52,52,0.6198347107438017,2025-04-25 15:32:46.496714,2025-04-25 15:32:46.591475,0 days 00:00:00.094761,0.0054832547748188566,,100,l1,0.005641052518632243,COMPLETE
53,53,0.6578947368421052,2025-04-25 15:32:46.591842,2025-04-25 15:32:46.683560,0 days 00:00:00.091718,0.04803770775367767,,100,l1,0.012396632550531,COMPLETE
54,54,0.5581395348837209,2025-04-25 15:32:46.683919,2025-04-25 15:32:46.797511,0 days 00:00:00.113592,0.08905531509915245,,300,l1,0.020999121388848747,COMPLETE
55,55,0.48163265306122455,2025-04-25 15:32:46.797901,2025-04-25 15:32:46.903311,0 days 00:00:00.105410,0.02264410502588234,,200,l1,0.059881589985355775,COMPLETE
56,56,0.3942307692307693,2025-04-25 15:32:46.903787,2025-04-25 15:32:47.058168,0 days 00:00:00.154381,0.0013830991238031995,,400,l1,0.005405043631540277,COMPLETE
57,57,0.6564885496183207,2025-04-25 15:32:47.058539,2025-04-25 15:32:47.182255,0 days 00:00:00.123716,0.012589716732695242,,100,l1,0.0019439224079752335,COMPLETE
58,58,0.31092436974789917,2025-04-25 15:32:47.182804,2025-04-25 15:32:47.330883,0 days 00:00:00.148079,0.004917748267210631,balanced,200,l1,0.0027768228281126847,COMPLETE
59,59,0.567251461988304,2025-04-25 15:32:47.331254,2025-04-25 15:32:47.440187,0 days 00:00:00.108933,0.3840404624605732,,100,l1,0.009426681313014074,COMPLETE
60,60,0.5705329153605014,2025-04-25 15:32:47.440525,2025-04-25 15:32:47.539904,0 days 00:00:00.099379,0.02632982563399596,,300,l1,0.00693016709807517,COMPLETE
61,61,0.6590038314176245,2025-04-25 15:32:47.540272,2025-04-25 15:32:47.652301,0 days 00:00:00.112029,0.016837369296352794,,200,l1,0.004018680774832769,COMPLETE
62,62,0.6590038314176245,2025-04-25 15:32:47.652632,2025-04-25 15:32:47.757575,0 days 00:00:00.104943,0.02062307089800856,,200,l1,0.0035365172906652973,COMPLETE
63,63,0.6073619631901841,2025-04-25 15:32:47.757952,2025-04-25 15:32:47.860004,0 days 00:00:00.102052,0.04573282853965118,,100,l1,0.004545498416277312,COMPLETE
64,64,0.6513409961685824,2025-04-25 15:32:47.860378,2025-04-25 15:32:47.972729,0 days 00:00:00.112351,0.010125391803066429,,300,l1,0.0026522015486883984,COMPLETE
65,65,0.5889967637540454,2025-04-25 15:32:47.973124,2025-04-25 15:32:48.097422,0 days 00:00:00.124298,0.03063499616965939,,200,l1,0.0017401786579673802,COMPLETE
66,66,0.5714285714285714,2025-04-25 15:32:48.097840,2025-04-25 15:32:48.208347,0 days 00:00:00.110507,0.1398827503909881,,400,l1,0.0032682420053966646,COMPLETE
67,67,0.6072874493927125,2025-04-25 15:32:48.208699,2025-04-25 15:32:48.323343,0 days 00:00:00.114644,0.004313590225963071,,100,l1,0.005783740334008404,COMPLETE
68,68,0.5681818181818181,2025-04-25 15:32:48.323697,2025-04-25 15:32:48.431126,0 days 00:00:00.107429,0.0875451007501501,,500,l1,0.006845697674146573,COMPLETE
69,69,0.6356589147286822,2025-04-25 15:32:48.431554,2025-04-25 15:32:48.552412,0 days 00:00:00.120858,0.007971460404990197,,200,l1,0.004360222848260071,COMPLETE
70,70,0.5590778097982709,2025-04-25 15:32:48.552779,2025-04-25 15:32:48.643333,0 days 00:00:00.090554,50.79269489797285,,100,l1,0.012540082531825612,COMPLETE
71,71,0.6564885496183207,2025-04-25 15:32:48.643744,2025-04-25 15:32:48.768514,0 days 00:00:00.124770,0.017355821490184258,,200,l1,0.0024108829164758904,COMPLETE
72,72,0.6590038314176245,2025-04-25 15:32:48.768885,2025-04-25 15:32:48.885893,0 days 00:00:00.117008,0.013175279823189803,,200,l1,0.004045414128241926,COMPLETE
73,73,0.6766917293233083,2025-04-25 15:32:48.886289,2025-04-25 15:32:49.004483,0 days 00:00:00.118194,0.03844866010068985,,100,l1,0.0016476373394520734,COMPLETE
74,74,0.5889212827988338,2025-04-25 15:32:49.004905,2025-04-25 15:32:49.125191,0 days 00:00:00.120286,0.04554923943369985,,100,l1,0.001737530152827592,COMPLETE
75,75,0.5804597701149425,2025-04-25 15:32:49.125657,2025-04-25 15:32:49.254057,0 days 00:00:00.128400,0.06313227582729754,,100,l1,0.0031481142696434964,COMPLETE
76,76,0.6086956521739131,2025-04-25 15:32:49.254435,2025-04-25 15:32:49.400691,0 days 00:00:00.146256,0.007303480165794843,,300,l1,0.0013186443299107225,COMPLETE
77,77,0.3082706766917293,2025-04-25 15:32:49.401123,2025-04-25 15:32:49.548825,0 days 00:00:00.147702,0.024216816434213907,balanced,600,l1,0.002089911852177869,COMPLETE
78,78,0.5616045845272206,2025-04-25 15:32:49.549190,2025-04-25 15:32:49.655692,0 days 00:00:00.106502,0.20017047572896718,,100,l1,0.0016104077457074907,COMPLETE
79,79,0.560344827586207,2025-04-25 15:32:49.656096,2025-04-25 15:32:49.784200,0 days 00:00:00.128104,0.002096009342389728,,200,l1,0.0008659360439769373,COMPLETE
80,80,0.6127946127946128,2025-04-25 15:32:49.784600,2025-04-25 15:32:49.885364,0 days 00:00:00.100764,0.038303175328383156,,100,l1,0.0049657068755588184,COMPLETE
81,81,0.6564885496183207,2025-04-25 15:32:49.885733,2025-04-25 15:32:49.991065,0 days 00:00:00.105332,0.017352905897272043,,200,l1,0.0039133078421681655,COMPLETE
82,82,0.6590038314176245,2025-04-25 15:32:49.991440,2025-04-25 15:32:50.095468,0 days 00:00:00.104028,0.012165070974864458,,200,l1,0.006560718674255258,COMPLETE
83,83,0.5714285714285715,2025-04-25 15:32:50.095846,2025-04-25 15:32:50.190535,0 days 00:00:00.094689,0.03245664446305591,,300,l1,0.008257818545201885,COMPLETE
84,84,0.6086956521739131,2025-04-25 15:32:50.190907,2025-04-25 15:32:50.311502,0 days 00:00:00.120595,0.007251148367647941,,100,l1,0.00275609077138467,COMPLETE
85,85,0.6590038314176245,2025-04-25 15:32:50.311846,2025-04-25 15:32:50.418940,0 days 00:00:00.107094,0.01934277777620528,,200,l1,0.003651182890746963,COMPLETE
86,86,0.6198347107438017,2025-04-25 15:32:50.419284,2025-04-25 15:32:50.538524,0 days 00:00:00.119240,0.0034574428568405623,,100,l1,0.004606155257771342,COMPLETE
87,87,0.6042296072507553,2025-04-25 15:32:50.538865,2025-04-25 15:32:50.646589,0 days 00:00:00.107724,0.06875367279361591,,100,l1,0.0023309299172198797,COMPLETE
88,88,0.3109987357774968,2025-04-25 15:32:50.646931,2025-04-25 15:32:50.748046,0 days 00:00:00.101115,0.01122147817090946,balanced,300,l1,0.0063160252376452,COMPLETE
89,89,0.679245283018868,2025-04-25 15:32:50.748398,2025-04-25 15:32:50.862873,0 days 00:00:00.114475,0.025552819397624604,,200,l1,0.003100476964659751,COMPLETE
90,90,0.5722379603399433,2025-04-25 15:32:50.863274,2025-04-25 15:32:50.962903,0 days 00:00:00.099629,0.11004862627032574,,100,l1,0.003201389528970035,COMPLETE
91,91,0.5759493670886077,2025-04-25 15:32:50.963274,2025-04-25 15:32:51.110738,0 days 00:00:00.147464,0.028445242870762503,,200,l1,0.0002565664837625795,COMPLETE
92,92,0.6590038314176245,2025-04-25 15:32:51.111146,2025-04-25 15:32:51.224292,0 days 00:00:00.113146,0.015548109778263344,,200,l1,0.004067500852012664,COMPLETE
93,93,0.586750788643533,2025-04-25 15:32:51.224897,2025-04-25 15:32:51.325019,0 days 00:00:00.100122,0.04199447248890429,,200,l1,0.005237705249501429,COMPLETE
94,94,0.6716981132075471,2025-04-25 15:32:51.325399,2025-04-25 15:32:51.450078,0 days 00:00:00.124679,0.022021199473737124,,100,l1,0.0025845610167948545,COMPLETE
95,95,0.4724919093851132,2025-04-25 15:32:51.450456,2025-04-25 15:32:51.671947,0 days 00:00:00.221491,0.022970139242381112,,100,l2,0.0020013951124591696,COMPLETE
96,96,0.6513409961685824,2025-04-25 15:32:51.672308,2025-04-25 15:32:51.793086,0 days 00:00:00.120778,0.009524380147706802,,100,l1,0.0025818533013913228,COMPLETE
97,97,0.5722379603399433,2025-04-25 15:32:51.793432,2025-04-25 15:32:51.915723,0 days 00:00:00.122291,0.056597028298851035,,100,l1,0.00014547364548416283,COMPLETE
98,98,0.5813953488372093,2025-04-25 15:32:51.916093,2025-04-25 15:32:52.036601,0 days 00:00:00.120508,19.684012352935795,,400,l1,0.0004989683975571088,COMPLETE
99,99,0.6000000000000001,2025-04-25 15:32:52.036988,2025-04-25 15:32:52.157543,0 days 00:00:00.120555,0.006129083535003102,,100,l1,0.0033536647614883924,COMPLETE
