,number,value,datetime_start,datetime_complete,duration,params_C,params_class_weight,params_max_iter,params_penalty,params_tol,state
0,0,0.8167069382119434,2025-05-02 18:40:02.605149,2025-05-02 18:40:03.644545,0 days 00:00:01.039396,0.0019187920706519891,,100,l2,0.06120875381739893,COMPLETE
1,1,0.9617354624887015,2025-05-02 18:40:03.647035,2025-05-02 18:40:09.975760,0 days 00:00:06.328725,0.11257712497232943,,600,l1,0.05515476021427666,COMPLETE
2,2,0.9617354624887015,2025-05-02 18:40:09.978195,2025-05-02 18:40:15.323340,0 days 00:00:05.345145,215.4074388360043,,400,l1,0.08175273001039225,COMPLETE
3,3,0.9740994343554631,2025-05-02 18:40:15.325345,2025-05-02 18:40:34.849153,0 days 00:00:19.523808,43.93181376528847,,700,l1,0.012022200519719473,COMPLETE
4,4,0.9623607347184583,2025-05-02 18:40:34.851440,2025-05-02 18:40:42.925661,0 days 00:00:08.074221,238.89866370999385,,300,l1,0.0017910757287258683,COMPLETE
5,5,0.9756532066508313,2025-05-02 18:40:42.927624,2025-05-02 18:40:59.130773,0 days 00:00:16.203149,154.08885192532242,balanced,400,l1,0.0003181994076118786,COMPLETE
6,6,0.9264660254421346,2025-05-02 18:40:59.133085,2025-05-02 18:41:28.348922,0 days 00:00:29.215837,1.1085243198947303,,600,l2,0.009348073817723263,COMPLETE
7,7,0.9756532066508313,2025-05-02 18:41:28.351247,2025-05-02 18:41:49.479829,0 days 00:00:21.128582,0.6319498820952207,balanced,600,l1,0.0003512145047499618,COMPLETE
8,8,0.962673088500903,2025-05-02 18:41:49.482175,2025-05-02 18:41:53.512132,0 days 00:00:04.029957,0.4411946991236461,,200,l1,0.00796481827823774,COMPLETE
9,9,0.9744047619047619,2025-05-02 18:41:53.514431,2025-05-02 18:42:01.245313,0 days 00:00:07.730882,138.50712807464416,,500,l1,0.012907155222529847,COMPLETE
10,10,0.9739490822972173,2025-05-02 18:42:01.247610,2025-05-02 18:43:06.787669,0 days 00:01:05.540059,11.416053596002678,balanced,1000,l2,0.00016850342069140524,COMPLETE
11,11,0.9762611275964391,2025-05-02 18:43:06.789999,2025-05-02 18:43:22.711470,0 days 00:00:15.921471,0.031492953336112774,balanced,700,l1,0.00024181471240659669,COMPLETE
12,12,0.9448592762780011,2025-05-02 18:43:22.713606,2025-05-02 18:43:32.644608,0 days 00:00:09.931002,0.007708292191452272,balanced,900,l1,0.0006984109794671303,COMPLETE
13,13,0.9762611275964391,2025-05-02 18:43:32.646068,2025-05-02 18:44:22.143392,0 days 00:00:49.497324,0.04754859561227949,balanced,800,l1,0.00014806245204400216,COMPLETE
14,14,0.9739490822972173,2025-05-02 18:44:22.159155,2025-05-02 18:45:16.083121,0 days 00:00:53.923966,0.029385160708740678,balanced,800,l1,0.00010785946329139277,COMPLETE
15,15,0.9448592762780011,2025-05-02 18:45:16.085547,2025-05-02 18:46:09.858561,0 days 00:00:53.773014,0.0329033110311458,balanced,800,l2,0.00133428426374566,COMPLETE
16,16,0.9445879988515647,2025-05-02 18:46:09.860758,2025-05-02 18:46:19.233918,0 days 00:00:09.373160,0.0013470711575251303,balanced,1000,l1,0.00036227929070240704,COMPLETE
17,17,0.9759572573463936,2025-05-02 18:46:19.235478,2025-05-02 18:46:39.508316,0 days 00:00:20.272838,5.413006235903225,balanced,800,l1,0.00012238864011543434,COMPLETE
18,18,0.9448592762780011,2025-05-02 18:46:39.510303,2025-05-02 18:47:16.328975,0 days 00:00:36.818672,0.09714796034176805,balanced,700,l2,0.0009339963557603008,COMPLETE
19,19,0.9448592762780011,2025-05-02 18:47:16.331143,2025-05-02 18:47:25.492330,0 days 00:00:09.161187,0.010160075802566232,balanced,900,l1,0.0026247071534942117,COMPLETE
20,20,0.9762611275964391,2025-05-02 18:47:25.493598,2025-05-02 18:47:42.930537,0 days 00:00:17.436939,0.1705307267643156,balanced,700,l1,0.00023777072733423057,COMPLETE
21,21,0.9762611275964391,2025-05-02 18:47:42.932675,2025-05-02 18:48:00.372232,0 days 00:00:17.439557,0.14993452950303277,balanced,700,l1,0.0001967750373169535,COMPLETE
22,22,0.9448592762780011,2025-05-02 18:48:00.373692,2025-05-02 18:48:05.944861,0 days 00:00:05.571169,0.010122912471433721,balanced,500,l1,0.0006277729924240544,COMPLETE
23,23,0.9759572573463936,2025-05-02 18:48:05.946120,2025-05-02 18:48:28.886068,0 days 00:00:22.939948,2.382859975683463,balanced,900,l1,0.0002733361286463396,COMPLETE
24,24,0.9762611275964391,2025-05-02 18:48:28.888242,2025-05-02 18:48:44.771784,0 days 00:00:15.883542,0.050617335315065584,balanced,700,l1,0.0005424234938812444,COMPLETE
25,25,0.9448592762780011,2025-05-02 18:48:44.773274,2025-05-02 18:48:53.200961,0 days 00:00:08.427687,0.004463219266446901,balanced,800,l1,0.00018844375805634122,COMPLETE
26,26,0.9448592762780011,2025-05-02 18:48:53.202232,2025-05-02 18:49:35.879210,0 days 00:00:42.676978,0.1667357788986035,balanced,700,l2,0.0047200269040372335,COMPLETE
27,27,0.9756532066508313,2025-05-02 18:49:35.881577,2025-05-02 18:49:48.374405,0 days 00:00:12.492828,0.327139224690812,balanced,500,l1,0.00010850302627172198,COMPLETE
28,28,0.9713610865072335,2025-05-02 18:49:48.375852,2025-05-02 18:50:08.798591,0 days 00:00:20.422739,0.02761076646421053,balanced,900,l1,0.00047415382845200665,COMPLETE
29,29,0.9448592762780011,2025-05-02 18:50:08.800563,2025-05-02 18:50:19.153397,0 days 00:00:10.352834,0.003615122789747154,balanced,600,l2,0.030233200325626305,COMPLETE
30,30,0.9707533234859675,2025-05-02 18:50:19.154865,2025-05-02 18:50:21.512720,0 days 00:00:02.357855,1.3841695044724562,balanced,100,l1,0.0010846393997014868,COMPLETE
31,31,0.9756532066508313,2025-05-02 18:50:21.513987,2025-05-02 18:50:38.987461,0 days 00:00:17.473474,0.19737776493594492,balanced,700,l1,0.00019684995946841975,COMPLETE
32,32,0.9762611275964391,2025-05-02 18:50:38.988905,2025-05-02 18:50:59.202318,0 days 00:00:20.213413,0.09711991684518982,balanced,800,l1,0.0002248279611032908,COMPLETE
33,33,0.9762611275964391,2025-05-02 18:50:59.204478,2025-05-02 18:51:16.525243,0 days 00:00:17.320765,0.06533388274772294,balanced,700,l1,0.00014311704797017517,COMPLETE
34,34,0.9448592762780011,2025-05-02 18:51:16.526699,2025-05-02 18:51:28.567513,0 days 00:00:12.040814,0.016386493390967708,balanced,600,l1,0.0002413664214079346,COMPLETE
35,35,0.9620481927710843,2025-05-02 18:51:28.570013,2025-05-02 18:51:39.062342,0 days 00:00:10.492329,0.20656498899548356,,700,l1,0.0004074146140569408,COMPLETE
36,36,0.9445879988515647,2025-05-02 18:51:39.063604,2025-05-02 18:51:43.179911,0 days 00:00:04.116307,0.0033996864244183692,balanced,400,l1,0.00015430287560297924,COMPLETE
37,37,0.9620481927710843,2025-05-02 18:51:43.181394,2025-05-02 18:51:52.221816,0 days 00:00:09.040422,0.6110493920866986,,600,l1,0.001632281261797315,COMPLETE
38,38,0.9759572573463936,2025-05-02 18:51:52.223081,2025-05-02 18:52:12.327934,0 days 00:00:20.104853,2.577880495721455,balanced,800,l1,0.00010022060076400652,COMPLETE
39,39,0.9762611275964391,2025-05-02 18:52:12.330086,2025-05-02 18:52:23.820228,0 days 00:00:11.490142,0.05823605025274154,balanced,500,l1,0.00032508771837565573,COMPLETE
40,40,0.9623607347184583,2025-05-02 18:52:23.821498,2025-05-02 18:53:02.311470,0 days 00:00:38.489972,909.2077882701441,,400,l2,0.0008824711049362624,COMPLETE
41,41,0.9762611275964391,2025-05-02 18:53:02.313821,2025-05-02 18:53:19.336594,0 days 00:00:17.022773,0.0542451210147118,balanced,700,l1,0.0005004879997876876,COMPLETE
42,42,0.9448592762780011,2025-05-02 18:53:19.338035,2025-05-02 18:53:32.235468,0 days 00:00:12.897433,0.016060400068258724,balanced,700,l1,0.0005903468924189354,COMPLETE
43,43,0.9756532066508313,2025-05-02 18:53:32.237459,2025-05-02 18:53:47.182927,0 days 00:00:14.945468,0.3109462386400899,balanced,600,l1,0.00025873157289342877,COMPLETE
44,44,0.9762611275964391,2025-05-02 18:53:47.184402,2025-05-02 18:54:05.538203,0 days 00:00:18.353801,0.11598088354886876,balanced,800,l1,0.000161000061768786,COMPLETE
45,45,0.9762611275964391,2025-05-02 18:54:05.539675,2025-05-02 18:54:27.010638,0 days 00:00:21.470963,0.047776230589119464,balanced,900,l1,0.00031466230053300766,COMPLETE
46,46,0.9532766990291262,2025-05-02 18:54:27.012635,2025-05-02 18:54:35.651383,0 days 00:00:08.638748,0.01729911371482167,,600,l1,0.0024263129936271262,COMPLETE
47,47,0.9756532066508313,2025-05-02 18:54:35.652868,2025-05-02 18:54:53.059642,0 days 00:00:17.406774,0.8817534074915252,balanced,700,l1,0.00020772452393917032,COMPLETE
48,48,0.9739490822972173,2025-05-02 18:54:53.061105,2025-05-02 18:55:11.008890,0 days 00:00:17.947785,0.028372060102831578,balanced,800,l1,0.0004314762591144229,COMPLETE
49,49,0.9448592762780011,2025-05-02 18:55:11.010887,2025-05-02 18:56:05.618505,0 days 00:00:54.607618,0.42432271402537103,balanced,700,l2,0.00013785813378515362,COMPLETE
50,50,0.9762611275964391,2025-05-02 18:56:05.620885,2025-05-02 18:56:30.796641,0 days 00:00:25.175756,0.1254635866623202,balanced,1000,l1,0.0007822231838468944,COMPLETE
51,51,0.9762611275964391,2025-05-02 18:56:30.798845,2025-05-02 18:56:50.374059,0 days 00:00:19.575214,0.08851243038970352,balanced,800,l1,0.00023276239334819705,COMPLETE
52,52,0.9762611275964391,2025-05-02 18:56:50.375544,2025-05-02 18:57:10.427141,0 days 00:00:20.051597,0.2199866367814133,balanced,800,l1,0.00031117026529860686,COMPLETE
53,53,0.9448592762780011,2025-05-02 18:57:10.428618,2025-05-02 18:57:20.380211,0 days 00:00:09.951593,0.006999871290032694,balanced,900,l1,0.00019169679127792363,COMPLETE
54,54,0.9762611275964391,2025-05-02 18:57:20.382216,2025-05-02 18:57:38.873770,0 days 00:00:18.491554,0.040168381953395414,balanced,800,l1,0.00014552559199456448,COMPLETE
55,55,0.9762611275964391,2025-05-02 18:57:38.875305,2025-05-02 18:57:56.910357,0 days 00:00:18.035052,0.0868480173614435,balanced,700,l1,0.0005958729832855787,COMPLETE
56,56,0.9448592762780011,2025-05-02 18:57:56.911817,2025-05-02 18:58:17.188623,0 days 00:00:20.276806,0.020758338476681164,balanced,900,l1,0.0002577536340261765,COMPLETE
57,57,0.9623607347184583,2025-05-02 18:58:17.190847,2025-05-02 18:58:26.282257,0 days 00:00:09.091410,0.14075675315450625,,600,l1,0.005282147818180496,COMPLETE
58,58,0.9739490822972173,2025-05-02 18:58:26.283575,2025-05-02 18:59:22.467695,0 days 00:00:56.184120,17.637060260359856,balanced,800,l2,0.00038038858345326335,COMPLETE
59,59,0.9445879988515647,2025-05-02 18:59:22.470107,2025-05-02 18:59:32.537497,0 days 00:00:10.067390,0.001987190766533912,balanced,1000,l1,0.00012736328072234247,COMPLETE
60,60,0.9756532066508313,2025-05-02 18:59:32.538998,2025-05-02 18:59:47.603062,0 days 00:00:15.064064,0.36218736530575535,balanced,600,l1,0.00017496710602815454,COMPLETE
61,61,0.9762611275964391,2025-05-02 18:59:47.605089,2025-05-02 19:00:04.003809,0 days 00:00:16.398720,0.06713176318569124,balanced,700,l1,0.00012489687790086186,COMPLETE
62,62,0.9442528735632184,2025-05-02 19:00:04.005174,2025-05-02 19:00:07.122525,0 days 00:00:03.117351,0.03697415225476594,balanced,700,l1,0.03315851618038117,COMPLETE
63,63,0.9762611275964391,2025-05-02 19:00:07.123742,2025-05-02 19:00:26.942378,0 days 00:00:19.818636,0.07549849862476496,balanced,800,l1,0.00010111026951693741,COMPLETE
64,64,0.9762611275964391,2025-05-02 19:00:26.943738,2025-05-02 19:00:44.523685,0 days 00:00:17.579947,0.24772187242595875,balanced,700,l1,0.0002262056315012153,COMPLETE
65,65,0.9448592762780011,2025-05-02 19:00:44.525711,2025-05-02 19:00:49.723479,0 days 00:00:05.197768,0.009348083783920831,balanced,500,l1,0.00014954517039205982,COMPLETE
66,66,0.9448592762780011,2025-05-02 19:00:49.724683,2025-05-02 19:01:05.553354,0 days 00:00:15.828671,0.023612993418616557,balanced,700,l1,0.00028551198551148694,COMPLETE
67,67,0.9448592762780011,2025-05-02 19:01:05.554712,2025-05-02 19:01:06.412549,0 days 00:00:00.857837,0.5858097049859905,balanced,800,l1,0.09535745782102699,COMPLETE
68,68,0.9448592762780011,2025-05-02 19:01:06.413771,2025-05-02 19:01:53.353854,0 days 00:00:46.940083,1.2784436096312783,balanced,700,l2,0.0005015101040885431,COMPLETE
69,69,0.9549549549549551,2025-05-02 19:01:53.356050,2025-05-02 19:02:00.612310,0 days 00:00:07.256260,0.013005487212223674,,600,l1,0.0001923827768087323,COMPLETE
70,70,0.9762611275964391,2025-05-02 19:02:00.614675,2025-05-02 19:02:26.963084,0 days 00:00:26.348409,0.15159215412048793,balanced,800,l1,0.001072286718906953,COMPLETE
71,71,0.9762611275964391,2025-05-02 19:02:26.964017,2025-05-02 19:02:57.360349,0 days 00:00:30.396332,0.05975073058699125,balanced,500,l1,0.0003331717417967826,COMPLETE
72,72,0.9762611275964391,2025-05-02 19:02:57.362784,2025-05-02 19:03:11.881419,0 days 00:00:14.518635,0.048751814736774125,balanced,300,l1,0.00033149241884526133,COMPLETE
73,73,0.9448592762780011,2025-05-02 19:03:11.883702,2025-05-02 19:03:20.968197,0 days 00:00:09.084495,0.006542129234765807,balanced,500,l1,0.00022617159366045657,COMPLETE
74,74,0.9762611275964391,2025-05-02 19:03:20.969699,2025-05-02 19:03:39.728232,0 days 00:00:18.758533,0.03411995676169484,balanced,600,l1,0.0001698059251310136,COMPLETE
75,75,0.9756532066508313,2025-05-02 19:03:39.730626,2025-05-02 19:03:49.370505,0 days 00:00:09.639879,0.10528494421604898,balanced,400,l1,0.0003864789908209081,COMPLETE
76,76,0.9762611275964391,2025-05-02 19:03:49.372003,2025-05-02 19:04:01.038066,0 days 00:00:11.666063,0.07392015401285976,balanced,500,l1,0.00012338364854316467,COMPLETE
77,77,0.9762611275964391,2025-05-02 19:04:01.040077,2025-05-02 19:04:25.638113,0 days 00:00:24.598036,0.19547581835506364,balanced,700,l1,0.0002750929089603737,COMPLETE
78,78,0.9448592762780011,2025-05-02 19:04:25.639697,2025-05-02 19:04:53.315941,0 days 00:00:27.676244,0.01197968887026451,balanced,900,l1,0.00048556080972701505,COMPLETE
79,79,0.8219931271477664,2025-05-02 19:04:53.318292,2025-05-02 19:05:26.921967,0 days 00:00:33.603675,0.024280597884439148,,600,l2,0.0007078213741868801,COMPLETE
80,80,0.9762611275964391,2025-05-02 19:05:26.924428,2025-05-02 19:05:48.790198,0 days 00:00:21.865770,0.04529140615726892,balanced,700,l1,0.00019765287945919144,COMPLETE
81,81,0.9762611275964391,2025-05-02 19:05:48.799943,2025-05-02 19:06:07.809140,0 days 00:00:19.009197,0.05087982022294371,balanced,700,l1,0.0004894047679533865,COMPLETE
82,82,0.9762611275964391,2025-05-02 19:06:07.811211,2025-05-02 19:06:29.660999,0 days 00:00:21.849788,0.11201231835814232,balanced,800,l1,0.00025642022908079615,COMPLETE
83,83,0.9762611275964391,2025-05-02 19:06:29.662565,2025-05-02 19:06:46.378813,0 days 00:00:16.716248,0.06270390721690926,balanced,700,l1,0.000570226161903832,COMPLETE
84,84,0.9756532066508313,2025-05-02 19:06:46.380891,2025-05-02 19:07:01.846461,0 days 00:00:15.465570,0.2796072808135894,balanced,600,l1,0.0004137228762536681,COMPLETE
85,85,0.9762611275964391,2025-05-02 19:07:01.847966,2025-05-02 19:07:22.191965,0 days 00:00:20.343999,0.14815333213672158,balanced,800,l1,0.0001610891149080191,COMPLETE
86,86,0.9739490822972173,2025-05-02 19:07:22.193475,2025-05-02 19:07:39.758371,0 days 00:00:17.564896,0.0339937369029798,balanced,700,l1,0.0003430471817867182,COMPLETE
87,87,0.9448592762780011,2025-05-02 19:07:39.760459,2025-05-02 19:07:54.026536,0 days 00:00:14.266077,0.0159906350557501,balanced,800,l1,0.001428760811145224,COMPLETE
88,88,0.9759572573463936,2025-05-02 19:07:54.028030,2025-05-02 19:08:17.219376,0 days 00:00:23.191346,0.8384625182993372,balanced,900,l1,0.0001159048714391934,COMPLETE
89,89,0.9762611275964391,2025-05-02 19:08:17.221604,2025-05-02 19:08:35.110342,0 days 00:00:17.888738,0.08700223950092646,balanced,700,l1,0.00029713771248807017,COMPLETE
90,90,0.9756532066508313,2025-05-02 19:08:35.111866,2025-05-02 19:08:50.502339,0 days 00:00:15.390473,0.5294603919877844,balanced,600,l1,0.00022403997415519573,COMPLETE
91,91,0.9762611275964391,2025-05-02 19:08:50.503854,2025-05-02 19:09:10.980218,0 days 00:00:20.476364,0.11837889421889196,balanced,800,l1,0.00014820918138491,COMPLETE
92,92,0.9762611275964391,2025-05-02 19:09:10.982318,2025-05-02 19:09:33.874154,0 days 00:00:22.891836,0.058856467805357596,balanced,900,l1,0.00016504852298505532,COMPLETE
93,93,0.9762611275964391,2025-05-02 19:09:33.875883,2025-05-02 19:09:54.346719,0 days 00:00:20.470836,0.1739097273123632,balanced,800,l1,0.00019955574807656654,COMPLETE
94,94,0.9739490822972173,2025-05-02 19:09:54.348805,2025-05-02 19:10:10.398414,0 days 00:00:16.049609,0.027868404238747382,balanced,700,l1,0.0002444153097821654,COMPLETE
95,95,0.9448592762780011,2025-05-02 19:10:10.399942,2025-05-02 19:10:28.626246,0 days 00:00:18.226304,0.021241376960779827,balanced,800,l1,0.00017440335073999052,COMPLETE
96,96,0.8289874703691161,2025-05-02 19:10:28.628537,2025-05-02 19:10:40.859430,0 days 00:00:12.230893,0.0981982754724804,,700,l2,0.0001380485791881755,COMPLETE
97,97,0.9762611275964391,2025-05-02 19:10:40.860739,2025-05-02 19:10:59.361660,0 days 00:00:18.500921,0.038841643209293154,balanced,800,l1,0.00011060976952135556,COMPLETE
98,98,0.9756532066508313,2025-05-02 19:10:59.363373,2025-05-02 19:11:15.761360,0 days 00:00:16.397987,0.33562879568595183,balanced,700,l1,0.011054400843458906,COMPLETE
99,99,0.9753489753489754,2025-05-02 19:11:15.763453,2025-05-02 19:11:36.514918,0 days 00:00:20.751465,2.3944546954991894,balanced,800,l1,0.0021672640615430193,COMPLETE
