,number,value,datetime_start,datetime_complete,duration,params_C,params_class_weight,params_max_iter,params_penalty,params_tol,state
0,0,0.9448592762780011,2025-04-15 14:37:06.557640,2025-04-15 14:37:20.591684,0 days 00:00:14.034044,0.01841192315132335,balanced,400,l2,0.03530418740495477,COMPLETE
1,1,0.9448592762780011,2025-04-15 14:37:20.593903,2025-04-15 14:38:46.900305,0 days 00:01:26.306402,14.358615259526921,balanced,700,l2,0.0016664378351750467,COMPLETE
2,2,0.857236411263916,2025-04-15 14:38:46.902263,2025-04-15 14:38:49.940831,0 days 00:00:03.038568,0.003901259860570147,,900,l2,0.008791456427558048,COMPLETE
3,3,0.9717208182912155,2025-04-15 14:38:49.942040,2025-04-15 14:39:06.525841,0 days 00:00:16.583801,6.232558655006794,,600,l1,0.00019089747373968446,COMPLETE
4,4,0.9448592762780011,2025-04-15 14:39:06.527262,2025-04-15 14:40:07.672511,0 days 00:01:01.145249,8.25384940050755,balanced,700,l2,0.0009807026536438005,COMPLETE
5,5,0.9522091974752028,2025-04-15 14:40:07.674638,2025-04-15 14:40:26.820552,0 days 00:00:19.145914,0.16413541450557959,,900,l2,0.00184569520303225,COMPLETE
6,6,0.8571428571428571,2025-04-15 14:40:26.826034,2025-04-15 14:40:33.109683,0 days 00:00:06.283649,0.005319237070528987,,400,l2,0.0007741105611999248,COMPLETE
7,7,0.9448592762780011,2025-04-15 14:40:33.112567,2025-04-15 14:40:36.984395,0 days 00:00:03.871828,0.001126377179301441,balanced,700,l2,0.001668814083482987,COMPLETE
8,8,0.9448592762780011,2025-04-15 14:40:36.991613,2025-04-15 14:41:01.093063,0 days 00:00:24.101450,772.0531756364228,balanced,300,l2,0.00033846434297994074,COMPLETE
9,9,0.9756532066508313,2025-04-15 14:41:01.095217,2025-04-15 14:41:09.616566,0 days 00:00:08.521349,41.47266642426141,balanced,700,l1,0.0278826301628985,COMPLETE
10,10,0.9733412322274881,2025-04-15 14:41:09.618678,2025-04-15 14:41:13.500438,0 days 00:00:03.881760,465.8263055963866,balanced,100,l1,0.051170031850029496,COMPLETE
11,11,0.9608187134502925,2025-04-15 14:41:13.502108,2025-04-15 14:41:16.074745,0 days 00:00:02.572637,906.5664808815867,balanced,100,l1,0.0844233990476796,COMPLETE
12,12,0.9756532066508313,2025-04-15 14:41:16.076083,2025-04-15 14:41:19.558670,0 days 00:00:03.482587,68.20811681136425,balanced,100,l1,0.011681936734558121,COMPLETE
13,13,0.9750445632798574,2025-04-15 14:41:19.560057,2025-04-15 14:41:51.749083,0 days 00:00:32.189026,62.813118680970184,balanced,1000,l1,0.010186154058579722,COMPLETE
14,14,0.9756532066508313,2025-04-15 14:41:51.751284,2025-04-15 14:42:01.560294,0 days 00:00:09.809010,0.704337312086495,balanced,300,l1,0.012860895767362221,COMPLETE
15,15,0.9753489753489754,2025-04-15 14:42:01.561712,2025-04-15 14:42:13.224010,0 days 00:00:11.662298,86.48160918815884,balanced,500,l1,0.020604381580006607,COMPLETE
16,16,0.9756532066508313,2025-04-15 14:42:13.225351,2025-04-15 14:42:19.848167,0 days 00:00:06.622816,70.48331823282054,balanced,200,l1,0.004940075980044658,COMPLETE
17,17,0.9750445632798574,2025-04-15 14:42:19.849460,2025-04-15 14:42:45.375535,0 days 00:00:25.526075,0.5736637250589748,balanced,800,l1,0.004708952672134109,COMPLETE
18,18,0.9701717384754444,2025-04-15 14:42:45.377693,2025-04-15 14:42:56.607034,0 days 00:00:11.229341,2.466463514730289,,500,l1,0.026882571208271942,COMPLETE
19,19,0.9756532066508313,2025-04-15 14:42:56.608353,2025-04-15 14:43:00.743504,0 days 00:00:04.135151,181.43045469745257,balanced,600,l1,0.0623908268885147,COMPLETE
20,20,0.9756532066508313,2025-04-15 14:43:00.745614,2025-04-15 14:43:12.770345,0 days 00:00:12.024731,30.86802408388659,balanced,800,l1,0.01726638560637266,COMPLETE
21,21,0.9756532066508313,2025-04-15 14:43:12.771759,2025-04-15 14:43:19.288589,0 days 00:00:06.516830,0.36490151377235,balanced,200,l1,0.010285332722461264,COMPLETE
22,22,0.9756532066508313,2025-04-15 14:43:19.289888,2025-04-15 14:43:26.174459,0 days 00:00:06.884571,0.10375808310093587,balanced,200,l1,0.015301844699749895,COMPLETE
23,23,0.9756532066508313,2025-04-15 14:43:26.175802,2025-04-15 14:43:36.098040,0 days 00:00:09.922238,2.933983041199287,balanced,300,l1,0.0056775293574138855,COMPLETE
24,24,0.9756532066508313,2025-04-15 14:43:36.100081,2025-04-15 14:43:39.516470,0 days 00:00:03.416389,1.2710199746665949,balanced,100,l1,0.03976898171575968,COMPLETE
25,25,0.9756532066508313,2025-04-15 14:43:39.517872,2025-04-15 14:43:49.482515,0 days 00:00:09.964643,22.148569094733304,balanced,300,l1,0.003403105319974487,COMPLETE
26,26,0.9442528735632184,2025-04-15 14:43:49.483802,2025-04-15 14:43:51.064180,0 days 00:00:01.580378,0.054405404278361394,balanced,400,l1,0.09864586361156572,COMPLETE
27,27,0.9678001805597353,2025-04-15 14:43:51.065512,2025-04-15 14:43:56.628459,0 days 00:00:05.562947,199.45193025322027,,200,l1,0.01131584783536783,COMPLETE
28,28,0.9756532066508313,2025-04-15 14:43:56.629752,2025-04-15 14:44:05.114112,0 days 00:00:08.484360,3.6167126364293987,balanced,500,l1,0.026579883774349448,COMPLETE
29,29,0.9756532066508313,2025-04-15 14:44:05.116200,2025-04-15 14:44:11.135902,0 days 00:00:06.019702,0.881327127089044,balanced,300,l1,0.03665198112689338,COMPLETE
30,30,0.9448592762780011,2025-04-15 14:44:11.137342,2025-04-15 14:44:22.439516,0 days 00:00:11.302174,0.018961774010201226,balanced,400,l1,0.006869279242916011,COMPLETE
31,31,0.9756532066508313,2025-04-15 14:44:22.440824,2025-04-15 14:44:29.222097,0 days 00:00:06.781273,64.81377317848987,balanced,200,l1,0.0033834257341894083,COMPLETE
32,32,0.9756532066508313,2025-04-15 14:44:29.223430,2025-04-15 14:44:32.666737,0 days 00:00:03.443307,218.7194469370709,balanced,100,l1,0.01442839349756316,COMPLETE
33,33,0.9756532066508313,2025-04-15 14:44:32.668045,2025-04-15 14:44:39.355808,0 days 00:00:06.687763,10.79720481917762,balanced,200,l1,0.007704192348666632,COMPLETE
34,34,0.9756532066508313,2025-04-15 14:44:39.357841,2025-04-15 14:44:49.442289,0 days 00:00:10.084448,31.160172611038153,balanced,600,l1,0.021956867621934405,COMPLETE
35,35,0.9668674698795181,2025-04-15 14:44:49.443682,2025-04-15 14:44:52.393140,0 days 00:00:02.949458,110.66006097183002,,100,l1,0.0051159553158655205,COMPLETE
36,36,0.9448592762780011,2025-04-15 14:44:52.394429,2025-04-15 14:45:58.805253,0 days 00:01:06.410824,15.701046420038223,balanced,800,l2,0.002319236857378846,COMPLETE
37,37,0.9711191335740073,2025-04-15 14:45:58.807419,2025-04-15 14:46:09.510478,0 days 00:00:10.703059,6.948836142453354,,400,l1,0.002650495825604299,COMPLETE
38,38,0.9448592762780011,2025-04-15 14:46:09.511914,2025-04-15 14:47:10.104737,0 days 00:01:00.592823,346.9697935213914,balanced,700,l2,0.004167149405384319,COMPLETE
39,39,0.9756532066508313,2025-04-15 14:47:10.106929,2025-04-15 14:47:20.137512,0 days 00:00:10.030583,45.672459080879065,balanced,300,l1,0.013094037848336631,COMPLETE
40,40,0.9528386902973865,2025-04-15 14:47:20.139675,2025-04-15 14:47:39.169844,0 days 00:00:19.030169,0.28870357334285934,,200,l2,0.007715002412283899,COMPLETE
41,41,0.9756532066508313,2025-04-15 14:47:39.171245,2025-04-15 14:47:43.984248,0 days 00:00:04.813003,163.92403011684056,balanced,600,l1,0.054840320777980546,COMPLETE
42,42,0.9756532066508313,2025-04-15 14:47:43.985807,2025-04-15 14:47:48.537777,0 days 00:00:04.551970,159.60630476053777,balanced,600,l1,0.06434015108268222,COMPLETE
43,43,0.9750445632798574,2025-04-15 14:47:48.539813,2025-04-15 14:48:11.703833,0 days 00:00:23.164020,343.7408545678713,balanced,700,l1,0.0009836534942294249,COMPLETE
44,44,0.9756532066508313,2025-04-15 14:48:11.705289,2025-04-15 14:48:20.248538,0 days 00:00:08.543249,663.0466090617954,balanced,600,l1,0.030153621019629505,COMPLETE
45,45,0.9756532066508313,2025-04-15 14:48:20.251237,2025-04-15 14:48:25.267270,0 days 00:00:05.016033,15.115952289181575,balanced,900,l1,0.04482531915329356,COMPLETE
46,46,0.9448592762780011,2025-04-15 14:48:25.268584,2025-04-15 14:48:38.896389,0 days 00:00:13.627805,38.51926072632848,balanced,700,l2,0.07792426626877999,COMPLETE
47,47,0.9750445632798574,2025-04-15 14:48:38.897836,2025-04-15 14:48:55.984174,0 days 00:00:17.086338,103.36540970412656,balanced,500,l1,0.00012031606410803204,COMPLETE
48,48,0.9756532066508313,2025-04-15 14:48:55.986236,2025-04-15 14:49:05.046993,0 days 00:00:09.060757,6.4017120490533985,balanced,800,l1,0.020882568015108675,COMPLETE
49,49,0.9756532066508313,2025-04-15 14:49:05.048418,2025-04-15 14:49:08.443213,0 days 00:00:03.394795,1.0827868807613088,balanced,100,l1,0.03254696274907382,COMPLETE
50,50,0.96593307205306,2025-04-15 14:49:08.444516,2025-04-15 14:49:11.597654,0 days 00:00:03.153138,451.2847120144392,,100,l1,0.001079965476396579,COMPLETE
51,51,0.9750445632798574,2025-04-15 14:49:11.598968,2025-04-15 14:49:27.922542,0 days 00:00:16.323574,23.389876510210847,balanced,900,l1,0.016901492350515468,COMPLETE
52,52,0.9756532066508313,2025-04-15 14:49:27.924685,2025-04-15 14:49:38.841421,0 days 00:00:10.916736,61.71453148827629,balanced,800,l1,0.018604868655874553,COMPLETE
53,53,0.9750445632798574,2025-04-15 14:49:38.842836,2025-04-15 14:50:01.623710,0 days 00:00:22.780874,1.8654138491544672,balanced,700,l1,0.013469153525858386,COMPLETE
54,54,0.9750445632798574,2025-04-15 14:50:01.625833,2025-04-15 14:50:27.493408,0 days 00:00:25.867575,34.270050761040935,balanced,800,l1,0.00929056370348128,COMPLETE
55,55,0.9756532066508313,2025-04-15 14:50:27.494852,2025-04-15 14:50:33.183482,0 days 00:00:05.688630,92.46163400668402,balanced,900,l1,0.053916663375576886,COMPLETE
56,56,0.9756532066508313,2025-04-15 14:50:33.185639,2025-04-15 14:50:42.667875,0 days 00:00:09.482236,4.491698779864231,balanced,1000,l1,0.02601497039533716,COMPLETE
57,57,0.9448592762780011,2025-04-15 14:50:42.669309,2025-04-15 14:51:30.960804,0 days 00:00:48.291495,214.85692475741558,balanced,600,l2,0.006421572914389105,COMPLETE
58,58,0.9756532066508313,2025-04-15 14:51:30.963047,2025-04-15 14:51:38.536875,0 days 00:00:07.573828,0.1306138026624508,balanced,200,l1,0.012088627649058298,COMPLETE
59,59,0.9756532066508313,2025-04-15 14:51:38.538955,2025-04-15 14:51:45.865017,0 days 00:00:07.326062,0.6185864818960306,balanced,700,l1,0.04008416533477466,COMPLETE
60,60,0.9727649496743634,2025-04-15 14:51:45.866454,2025-04-15 14:51:49.126055,0 days 00:00:03.259601,12.792674759231863,balanced,500,l1,0.07102878741180725,COMPLETE
61,61,0.9739490822972173,2025-04-15 14:51:49.127385,2025-04-15 14:51:59.136113,0 days 00:00:10.008728,0.03363029512859281,balanced,300,l1,0.009843407256923805,COMPLETE
62,62,0.9756532066508313,2025-04-15 14:51:59.137462,2025-04-15 14:52:05.613470,0 days 00:00:06.476008,0.26769624680638326,balanced,200,l1,0.00428633926176272,COMPLETE
63,63,0.9756532066508313,2025-04-15 14:52:05.614797,2025-04-15 14:52:12.329774,0 days 00:00:06.714977,0.5207460658434565,balanced,200,l1,0.016857221437377216,COMPLETE
64,64,0.9733412322274881,2025-04-15 14:52:12.331895,2025-04-15 14:52:15.730580,0 days 00:00:03.398685,0.27924930627624367,balanced,100,l1,0.009116441739762591,COMPLETE
65,65,0.9756532066508313,2025-04-15 14:52:15.732008,2025-04-15 14:52:25.814709,0 days 00:00:10.082701,0.07062393012064207,balanced,300,l1,0.0004848791196609596,COMPLETE
66,66,0.8146611341632088,2025-04-15 14:52:25.816054,2025-04-15 14:52:28.459136,0 days 00:00:02.643082,0.002610854098257658,,200,l1,0.02348821536283178,COMPLETE
67,67,0.9733412322274881,2025-04-15 14:52:28.460293,2025-04-15 14:52:31.902682,0 days 00:00:03.442389,67.7408151018305,balanced,100,l1,0.00580855538193508,COMPLETE
68,68,0.9753489753489754,2025-04-15 14:52:31.904016,2025-04-15 14:52:44.868900,0 days 00:00:12.964884,26.46559158692055,balanced,400,l1,0.011080117738258255,COMPLETE
69,69,0.9448592762780011,2025-04-15 14:52:44.870994,2025-04-15 14:53:20.706442,0 days 00:00:35.835448,1.6275090990926795,balanced,800,l2,0.007609595767680067,COMPLETE
70,70,0.9588561423985994,2025-04-15 14:53:20.708689,2025-04-15 14:53:22.989616,0 days 00:00:02.280927,133.72030575404042,balanced,200,l1,0.09861402972746805,COMPLETE
71,71,0.9756532066508313,2025-04-15 14:53:22.990923,2025-04-15 14:53:32.809920,0 days 00:00:09.818997,0.09991083919447681,balanced,300,l1,0.016170119173755566,COMPLETE
72,72,0.9756532066508313,2025-04-15 14:53:32.812030,2025-04-15 14:53:39.476046,0 days 00:00:06.664016,0.1969819345237514,balanced,200,l1,0.01415401356664203,COMPLETE
73,73,0.9733412322274881,2025-04-15 14:53:39.477517,2025-04-15 14:53:42.830285,0 days 00:00:03.352768,0.4536584031534552,balanced,100,l1,0.032536553719931374,COMPLETE
74,74,0.9448592762780011,2025-04-15 14:53:42.831602,2025-04-15 14:53:48.711065,0 days 00:00:05.879463,0.018938297063554856,balanced,200,l1,0.019567461910645706,COMPLETE
75,75,0.963609022556391,2025-04-15 14:53:48.712434,2025-04-15 14:53:54.895038,0 days 00:00:06.182604,0.03473572859476557,,300,l1,0.010996580234140827,COMPLETE
76,76,0.9733412322274881,2025-04-15 14:53:54.897115,2025-04-15 14:53:58.460370,0 days 00:00:03.563255,275.9331248808065,balanced,100,l1,0.024587457959297294,COMPLETE
77,77,0.9448592762780011,2025-04-15 14:53:58.461608,2025-04-15 14:54:02.427112,0 days 00:00:03.965504,0.009152786674240874,balanced,200,l1,0.0036829134815926728,COMPLETE
78,78,0.9756532066508313,2025-04-15 14:54:02.429074,2025-04-15 14:54:12.895039,0 days 00:00:10.465965,631.2383822902799,balanced,300,l1,0.002888042221206246,COMPLETE
79,79,0.9448592762780011,2025-04-15 14:54:12.896375,2025-04-15 14:55:09.232781,0 days 00:00:56.336406,0.7370322688866985,balanced,700,l2,0.0019313734910123106,COMPLETE
80,80,0.9750445632798574,2025-04-15 14:55:09.235444,2025-04-15 14:55:28.720811,0 days 00:00:19.485367,9.212749668277876,balanced,600,l1,0.0052078130311463584,COMPLETE
81,81,0.9753489753489754,2025-04-15 14:55:28.723046,2025-04-15 14:55:41.718404,0 days 00:00:12.995358,2.6054349702389628,balanced,400,l1,0.006925990183022194,COMPLETE
82,82,0.9753489753489754,2025-04-15 14:55:41.719784,2025-04-15 14:55:54.753585,0 days 00:00:13.033801,42.310373278447905,balanced,400,l1,0.007999404198581365,COMPLETE
83,83,0.9756532066508313,2025-04-15 14:55:54.755703,2025-04-15 14:56:01.339545,0 days 00:00:06.583842,51.68174421918479,balanced,200,l1,0.006094400476938581,COMPLETE
84,84,0.9756532066508313,2025-04-15 14:56:01.340963,2025-04-15 14:56:11.539456,0 days 00:00:10.198493,131.813255719472,balanced,300,l1,0.014491735517685159,COMPLETE
85,85,0.9756532066508313,2025-04-15 14:56:11.540831,2025-04-15 14:56:16.616577,0 days 00:00:05.075746,19.106801727206722,balanced,500,l1,0.0484387730173053,COMPLETE
86,86,0.9656212303980699,2025-04-15 14:56:16.617981,2025-04-15 14:56:19.754636,0 days 00:00:03.136655,3.7979224753130394,,100,l1,0.0281264025841441,COMPLETE
87,87,0.9750445632798574,2025-04-15 14:56:19.755956,2025-04-15 14:56:42.675011,0 days 00:00:22.919055,81.21914383101281,balanced,700,l1,0.009091683146508473,COMPLETE
88,88,0.9750445632798574,2025-04-15 14:56:42.677237,2025-04-15 14:57:06.116561,0 days 00:00:23.439324,0.4023239559311583,balanced,800,l1,0.012057024141554155,COMPLETE
89,89,0.9756532066508313,2025-04-15 14:57:06.118825,2025-04-15 14:57:15.738946,0 days 00:00:09.620121,0.16402487786662656,balanced,300,l1,0.019504315686155398,COMPLETE
90,90,0.9756532066508313,2025-04-15 14:57:15.740301,2025-04-15 14:57:21.376767,0 days 00:00:05.636466,0.09493163485807615,balanced,200,l1,0.038003085234707905,COMPLETE
91,91,0.9756532066508313,2025-04-15 14:57:21.378128,2025-04-15 14:57:24.922888,0 days 00:00:03.544760,0.941178859235881,balanced,100,l1,0.06710091973725127,COMPLETE
92,92,0.9733412322274881,2025-04-15 14:57:24.924285,2025-04-15 14:57:28.295788,0 days 00:00:03.371503,4.975774113260999,balanced,100,l1,0.04283082609149104,COMPLETE
93,93,0.9756532066508313,2025-04-15 14:57:28.297133,2025-04-15 14:57:31.749600,0 days 00:00:03.452467,1.4053630892280744,balanced,100,l1,0.05994750844778234,COMPLETE
94,94,0.9756532066508313,2025-04-15 14:57:31.751763,2025-04-15 14:57:38.436104,0 days 00:00:06.684341,0.36073489711915313,balanced,200,l1,0.016700234219500877,COMPLETE
95,95,0.9750445632798574,2025-04-15 14:57:38.437448,2025-04-15 14:57:53.322010,0 days 00:00:14.884562,2.5701520705508814,balanced,600,l1,0.02198865857295049,COMPLETE
96,96,0.9448592762780011,2025-04-15 14:57:53.323296,2025-04-15 14:58:17.761786,0 days 00:00:24.438490,32.638452292527965,balanced,300,l2,0.004622614660480939,COMPLETE
97,97,0.9733412322274881,2025-04-15 14:58:17.763855,2025-04-15 14:58:21.417422,0 days 00:00:03.653567,1.36312347701004,balanced,100,l1,0.03450951918022476,COMPLETE
98,98,0.9756532066508313,2025-04-15 14:58:21.418657,2025-04-15 14:58:27.924162,0 days 00:00:06.505505,0.2040166360462021,balanced,200,l1,0.003859980099449907,COMPLETE
99,99,0.9780186690755797,2025-04-15 14:58:27.925420,2025-04-15 14:58:42.857017,0 days 00:00:14.931597,18.312952545407466,,700,l1,0.009955835372052269,COMPLETE
