,number,value,datetime_start,datetime_complete,duration,params_C,params_class_weight,params_max_iter,params_penalty,params_tol,state
0,0,0.9448751076658054,2025-04-28 17:02:48.580462,2025-04-28 17:02:52.064485,0 days 00:00:03.484023,219.75289511559998,,100,l2,0.0089955054227492,COMPLETE
1,1,0.9426476929711083,2025-04-28 17:02:52.064859,2025-04-28 17:02:55.210131,0 days 00:00:03.145272,1.1785357776041985,,200,l2,0.025664250223762314,COMPLETE
2,2,0.9658083579569439,2025-04-28 17:02:55.210439,2025-04-28 17:02:58.285607,0 days 00:00:03.075168,12.028186319410109,balanced,100,l2,0.02386705179855885,COMPLETE
3,3,0.9685798072894848,2025-04-28 17:02:58.285976,2025-04-28 17:03:04.553209,0 days 00:00:06.267233,0.21055424842304019,balanced,900,l2,0.00013056333776148584,COMPLETE
4,4,0.9675789473684209,2025-04-28 17:03:04.553526,2025-04-28 17:03:08.019878,0 days 00:00:03.466352,0.013743794981100812,balanced,600,l2,0.0022215739237581933,COMPLETE
5,5,0.9684210526315788,2025-04-28 17:03:08.020184,2025-04-28 17:03:11.452839,0 days 00:00:03.432655,38.08630568553353,balanced,300,l2,0.0031772633167578748,COMPLETE
6,6,0.9366535605067715,2025-04-28 17:03:11.453166,2025-04-28 17:03:14.761551,0 days 00:00:03.308385,0.0012181922805662476,,1000,l1,0.00039042014977510773,COMPLETE
7,7,0.9274858879722101,2025-04-28 17:03:14.761866,2025-04-28 17:03:17.556162,0 days 00:00:02.794296,0.5847625076328263,,100,l2,0.07496082196521235,COMPLETE
8,8,0.9718369062631357,2025-04-28 17:03:17.556485,2025-04-28 17:03:21.464601,0 days 00:00:03.908116,0.00868875955447627,,400,l2,0.0008666251300613131,COMPLETE
9,9,0.9673366834170856,2025-04-28 17:03:21.464912,2025-04-28 17:03:23.858424,0 days 00:00:02.393512,20.218379957942805,,100,l1,0.00046920720312718366,COMPLETE
10,10,0.9704391891891893,2025-04-28 17:03:23.858737,2025-04-28 17:03:26.624446,0 days 00:00:02.765709,0.013385944959169225,,500,l1,0.0011859403223135046,COMPLETE
11,11,0.9695688926458156,2025-04-28 17:03:26.624782,2025-04-28 17:03:29.379120,0 days 00:00:02.754338,0.01279401146870917,,500,l1,0.0011894206096586563,COMPLETE
12,12,0.9366535605067715,2025-04-28 17:03:29.379455,2025-04-28 17:03:32.551033,0 days 00:00:03.171578,0.001140142447463978,,500,l1,0.00072962209482845,COMPLETE
13,13,0.9734736842105264,2025-04-28 17:03:32.551350,2025-04-28 17:03:35.309298,0 days 00:00:02.757948,0.029346317931501827,,700,l1,0.00014361509558453403,COMPLETE
14,14,0.9726546066470341,2025-04-28 17:03:35.309621,2025-04-28 17:03:38.160062,0 days 00:00:02.850441,0.05812351841708228,,700,l1,0.00011785289361922667,COMPLETE
15,15,0.9714045416316232,2025-04-28 17:03:38.160381,2025-04-28 17:03:41.277704,0 days 00:00:03.117323,0.12336569993769948,,700,l1,0.00011641070102688278,COMPLETE
16,16,0.9722455845248108,2025-04-28 17:03:41.278034,2025-04-28 17:03:43.952887,0 days 00:00:02.674853,0.06643261137368374,,800,l1,0.0002177859483455324,COMPLETE
17,17,0.9653155035520268,2025-04-28 17:03:43.953208,2025-04-28 17:03:46.434483,0 days 00:00:02.481275,2.8526678459126704,,700,l1,0.00025584406656321124,COMPLETE
18,18,0.9727234578262695,2025-04-28 17:03:46.434804,2025-04-28 17:03:49.369027,0 days 00:00:02.934223,0.06255711595608368,balanced,800,l1,0.00011523382927917766,COMPLETE
19,19,0.9626485568760611,2025-04-28 17:03:49.369349,2025-04-28 17:03:51.941760,0 days 00:00:02.572411,0.004567867327909606,balanced,900,l1,0.004342015233853588,COMPLETE
20,20,0.9694688414889169,2025-04-28 17:03:51.942085,2025-04-28 17:03:54.463303,0 days 00:00:02.521218,0.3978677327895221,balanced,1000,l1,0.00027376920571853746,COMPLETE
21,21,0.9727234578262695,2025-04-28 17:03:54.463652,2025-04-28 17:03:57.319326,0 days 00:00:02.855674,0.05152105622546932,balanced,700,l1,0.00010181966093464562,COMPLETE
22,22,0.9739714525608733,2025-04-28 17:03:57.319646,2025-04-28 17:04:00.102984,0 days 00:00:02.783338,0.04116448362914811,balanced,800,l1,0.00017940784752050942,COMPLETE
23,23,0.9735405291894162,2025-04-28 17:04:00.103444,2025-04-28 17:04:02.834952,0 days 00:00:02.731508,0.03845996617214652,balanced,800,l1,0.0001929096163748001,COMPLETE
24,24,0.9613259668508287,2025-04-28 17:04:02.835277,2025-04-28 17:04:07.099336,0 days 00:00:04.264059,0.003949113879465776,balanced,800,l1,0.000454673427594249,COMPLETE
25,25,0.9661795407098122,2025-04-28 17:04:07.099681,2025-04-28 17:04:09.686425,0 days 00:00:02.586744,1.8356318731218697,balanced,600,l1,0.0002239579820758422,COMPLETE
26,26,0.973109243697479,2025-04-28 17:04:09.686762,2025-04-28 17:04:12.308967,0 days 00:00:02.622205,0.03476301487560307,balanced,900,l1,0.0006078966677844854,COMPLETE
27,27,0.972338642078793,2025-04-28 17:04:12.309279,2025-04-28 17:04:15.269014,0 days 00:00:02.959735,0.15577353686348847,balanced,800,l1,0.0001902125287902601,COMPLETE
28,28,0.9383145091225021,2025-04-28 17:04:15.269348,2025-04-28 17:04:19.153120,0 days 00:00:03.883772,0.003094188441159451,balanced,600,l1,0.001594558512160815,COMPLETE
29,29,0.9735182849936949,2025-04-28 17:04:19.153442,2025-04-28 17:04:21.840527,0 days 00:00:02.687085,0.023292847914368232,balanced,900,l1,0.00035244361207894707,COMPLETE
30,30,0.9673640167364017,2025-04-28 17:04:21.840856,2025-04-28 17:04:24.010428,0 days 00:00:02.169572,547.0791026053981,balanced,1000,l1,0.006049846686899485,COMPLETE
31,31,0.9735182849936949,2025-04-28 17:04:24.010758,2025-04-28 17:04:26.753590,0 days 00:00:02.742832,0.023365433922412946,balanced,900,l1,0.0003175337763975979,COMPLETE
32,32,0.9735182849936949,2025-04-28 17:04:26.753918,2025-04-28 17:04:29.409645,0 days 00:00:02.655727,0.0229190836647891,balanced,900,l1,0.00034195922368416247,COMPLETE
33,33,0.9706621961441744,2025-04-28 17:04:29.409963,2025-04-28 17:04:31.547684,0 days 00:00:02.137721,0.28390187767398906,balanced,900,l1,0.012592400223673252,COMPLETE
34,34,0.9661795407098122,2025-04-28 17:04:31.548011,2025-04-28 17:04:33.952355,0 days 00:00:02.404344,4.810654848363683,balanced,1000,l1,0.0005658370953850313,COMPLETE
35,35,0.9718841796055392,2025-04-28 17:04:33.952689,2025-04-28 17:04:38.040931,0 days 00:00:04.088242,0.006021761964579272,balanced,800,l2,0.00018308761232371047,COMPLETE
36,36,0.9673913043478259,2025-04-28 17:04:38.041252,2025-04-28 17:04:40.474268,0 days 00:00:02.433016,0.94016662598637,balanced,900,l1,0.0003719085152822807,COMPLETE
37,37,0.969823973176865,2025-04-28 17:04:40.474580,2025-04-28 17:04:43.851467,0 days 00:00:03.376887,0.09879397461877344,balanced,800,l2,0.0009636376660233435,COMPLETE
38,38,0.973109243697479,2025-04-28 17:04:43.851818,2025-04-28 17:04:46.257216,0 days 00:00:02.405398,0.019706618077103784,balanced,900,l1,0.0016869450882757546,COMPLETE
39,39,0.9337349397590361,2025-04-28 17:04:46.257538,2025-04-28 17:04:49.009359,0 days 00:00:02.751821,0.249036743942299,balanced,1000,l2,0.07698553962210211,COMPLETE
40,40,0.9661303979678239,2025-04-28 17:04:49.009687,2025-04-28 17:04:53.606331,0 days 00:00:04.596644,0.00628815767492033,balanced,300,l1,0.00016373797175662778,COMPLETE
41,41,0.973109243697479,2025-04-28 17:04:53.606685,2025-04-28 17:04:56.515357,0 days 00:00:02.908672,0.028631588521856974,balanced,900,l1,0.00030839085871753547,COMPLETE
42,42,0.9381533101045295,2025-04-28 17:04:56.515713,2025-04-28 17:05:00.205308,0 days 00:00:03.689595,0.0019462661121150196,balanced,900,l1,0.00042047279091148807,COMPLETE
43,43,0.9700548291859974,2025-04-28 17:05:00.205641,2025-04-28 17:05:04.048774,0 days 00:00:03.843133,0.011685501773105844,balanced,1000,l1,0.0002763450454052714,COMPLETE
44,44,0.9735182849936949,2025-04-28 17:05:04.049111,2025-04-28 17:05:06.845689,0 days 00:00:02.796578,0.02365696883896239,balanced,800,l1,0.0006630463912375105,COMPLETE
45,45,0.9697732997481109,2025-04-28 17:05:06.846029,2025-04-28 17:05:11.418086,0 days 00:00:04.572057,93.14645362920979,balanced,1000,l2,0.00036081403254254455,COMPLETE
46,46,0.7942583732057418,2025-04-28 17:05:11.418406,2025-04-28 17:05:13.560390,0 days 00:00:02.141984,0.0021868636772527875,balanced,900,l1,0.04469579250294075,COMPLETE
47,47,0.9666110183639399,2025-04-28 17:05:13.560745,2025-04-28 17:05:16.342013,0 days 00:00:02.781268,0.733967015428663,balanced,700,l1,0.00015711965631612718,COMPLETE
48,48,0.9700548291859974,2025-04-28 17:05:16.342339,2025-04-28 17:05:19.607321,0 days 00:00:03.264982,0.01016410417953835,balanced,800,l1,0.000915755154499898,COMPLETE
49,49,0.9719312945119397,2025-04-28 17:05:19.607666,2025-04-28 17:05:21.816385,0 days 00:00:02.208719,0.0879331332284422,balanced,600,l1,0.0024938528727199995,COMPLETE
50,50,0.9589381999170469,2025-04-28 17:05:21.816715,2025-04-28 17:05:25.311174,0 days 00:00:03.494459,0.017859214981373224,balanced,900,l2,0.0005104371004021425,COMPLETE
51,51,0.9735182849936949,2025-04-28 17:05:25.311509,2025-04-28 17:05:27.962298,0 days 00:00:02.650789,0.025590074100467517,balanced,800,l1,0.0006215609672018405,COMPLETE
52,52,0.9731543624161074,2025-04-28 17:05:27.962629,2025-04-28 17:05:30.878561,0 days 00:00:02.915932,0.04530824950200437,balanced,800,l1,0.00032693446808300023,COMPLETE
53,53,0.9710691823899371,2025-04-28 17:05:30.878918,2025-04-28 17:05:33.365040,0 days 00:00:02.486122,0.16329648187958337,balanced,700,l1,0.0007558343979013026,COMPLETE
54,54,0.9704890387858347,2025-04-28 17:05:33.365401,2025-04-28 17:05:36.380198,0 days 00:00:03.014797,0.017620078845128197,balanced,900,l1,0.00022544352986216402,COMPLETE
55,55,0.966567922132882,2025-04-28 17:05:36.380554,2025-04-28 17:05:39.617481,0 days 00:00:03.236927,0.009108004236118565,balanced,800,l1,0.0012779471488428386,COMPLETE
56,56,0.9682539682539683,2025-04-28 17:05:39.617815,2025-04-28 17:05:42.447357,0 days 00:00:02.829542,0.4309103962423126,balanced,400,l1,0.0001314953402971904,COMPLETE
57,57,0.9739714525608733,2025-04-28 17:05:42.447724,2025-04-28 17:05:45.276801,0 days 00:00:02.829077,0.04173180258148047,balanced,700,l1,0.00019917374235955962,COMPLETE
58,58,0.9713804713804713,2025-04-28 17:05:45.277324,2025-04-28 17:05:48.296511,0 days 00:00:03.019187,0.08969001018483348,,700,l1,0.00014316726743951265,COMPLETE
59,59,0.9731543624161074,2025-04-28 17:05:48.296850,2025-04-28 17:05:51.189652,0 days 00:00:02.892802,0.04713567555163999,balanced,600,l1,0.00018998159010004506,COMPLETE
60,60,0.9652836579170195,2025-04-28 17:05:51.189981,2025-04-28 17:05:55.161780,0 days 00:00:03.971799,0.0059460876005914395,balanced,700,l1,0.0002594964868799894,COMPLETE
61,61,0.973109243697479,2025-04-28 17:05:55.162122,2025-04-28 17:05:57.778365,0 days 00:00:02.616243,0.03029769722359426,balanced,800,l1,0.0003937072641194835,COMPLETE
62,62,0.9735182849936949,2025-04-28 17:05:57.778695,2025-04-28 17:06:00.664657,0 days 00:00:02.885962,0.021790549212136575,balanced,900,l1,0.00020547547265109496,COMPLETE
63,63,0.9727234578262695,2025-04-28 17:06:00.665013,2025-04-28 17:06:03.631459,0 days 00:00:02.966446,0.07109357196965561,balanced,800,l1,0.0001040289608446791,COMPLETE
64,64,0.9700548291859974,2025-04-28 17:06:03.631824,2025-04-28 17:06:07.089987,0 days 00:00:03.458163,0.01342564982821565,balanced,800,l1,0.00029824100174531486,COMPLETE
65,65,0.9739714525608733,2025-04-28 17:06:07.090333,2025-04-28 17:06:09.733717,0 days 00:00:02.643384,0.03992650008271945,balanced,700,l1,0.0004604975130638571,COMPLETE
66,66,0.9714045416316232,2025-04-28 17:06:09.734049,2025-04-28 17:06:12.075111,0 days 00:00:02.341062,0.1374906738197862,,700,l1,0.00046839761274552945,COMPLETE
67,67,0.9731543624161074,2025-04-28 17:06:12.075449,2025-04-28 17:06:14.853849,0 days 00:00:02.778400,0.0453951314915093,balanced,500,l1,0.00022950677498221627,COMPLETE
68,68,0.973109243697479,2025-04-28 17:06:14.854195,2025-04-28 17:06:17.694581,0 days 00:00:02.840386,0.03627544713015276,balanced,600,l1,0.00016256862227810454,COMPLETE
69,69,0.9689857502095558,2025-04-28 17:06:17.694921,2025-04-28 17:06:23.991073,0 days 00:00:06.296152,0.22552405121806413,balanced,700,l2,0.00012952200032362125,COMPLETE
70,70,0.9661303979678239,2025-04-28 17:06:23.991414,2025-04-28 17:06:27.803244,0 days 00:00:03.811830,0.008085944869616743,balanced,900,l1,0.0004998306873272704,COMPLETE
71,71,0.9704890387858347,2025-04-28 17:06:27.803586,2025-04-28 17:06:30.792042,0 days 00:00:02.988456,0.016574262794025216,balanced,800,l1,0.0007013734276772674,COMPLETE
72,72,0.9735182849936949,2025-04-28 17:06:30.792382,2025-04-28 17:06:33.601147,0 days 00:00:02.808765,0.02563861962381893,balanced,900,l1,0.00029457193689362283,COMPLETE
73,73,0.9731543624161074,2025-04-28 17:06:33.601492,2025-04-28 17:06:36.286000,0 days 00:00:02.684508,0.06856353440902314,balanced,800,l1,0.0003865461075976344,COMPLETE
74,74,0.972338642078793,2025-04-28 17:06:36.286335,2025-04-28 17:06:39.133612,0 days 00:00:02.847277,0.12875005297802417,balanced,1000,l1,0.0002399130145411992,COMPLETE
75,75,0.9739714525608733,2025-04-28 17:06:39.133955,2025-04-28 17:06:41.934084,0 days 00:00:02.800129,0.0410225626096195,balanced,800,l1,0.0003374404276368027,COMPLETE
76,76,0.9726546066470341,2025-04-28 17:06:41.934426,2025-04-28 17:06:44.523475,0 days 00:00:02.589049,0.03924774834991177,,700,l1,0.00033868312336177793,COMPLETE
77,77,0.9731543624161074,2025-04-28 17:06:44.523835,2025-04-28 17:06:47.364821,0 days 00:00:02.840986,0.08828405086166374,balanced,900,l1,0.00019981479848229502,COMPLETE
78,78,0.9613259668508287,2025-04-28 17:06:47.365177,2025-04-28 17:06:51.290530,0 days 00:00:03.925353,0.003764086374098716,balanced,900,l1,0.0004468766874138741,COMPLETE
79,79,0.9682539682539683,2025-04-28 17:06:51.290883,2025-04-28 17:06:53.948675,0 days 00:00:02.657792,0.3991265259125809,balanced,1000,l1,0.0001621171225182445,COMPLETE
80,80,0.9657794676806083,2025-04-28 17:06:53.949019,2025-04-28 17:06:57.849995,0 days 00:00:03.900976,0.002222933956692696,balanced,200,l2,0.0005560127611735805,COMPLETE
81,81,0.9714765100671141,2025-04-28 17:06:57.850341,2025-04-28 17:07:00.029216,0 days 00:00:02.178875,0.05151758617054978,balanced,800,l1,0.011246773084790917,COMPLETE
82,82,0.9700548291859974,2025-04-28 17:07:00.029562,2025-04-28 17:07:03.431003,0 days 00:00:03.401441,0.01229328451731542,balanced,800,l1,0.0006677033197316656,COMPLETE
83,83,0.9735182849936949,2025-04-28 17:07:03.431326,2025-04-28 17:07:06.334240,0 days 00:00:02.902914,0.02590731640485902,balanced,800,l1,0.00026400905034161244,COMPLETE
84,84,0.9661303979678239,2025-04-28 17:07:06.334601,2025-04-28 17:07:10.212296,0 days 00:00:03.877695,0.00783839350439697,balanced,700,l1,0.0007986614226098132,COMPLETE
85,85,0.9654022509378908,2025-04-28 17:07:10.212636,2025-04-28 17:07:12.675433,0 days 00:00:02.462797,14.17534073252229,balanced,900,l1,0.0003376322770034614,COMPLETE
86,86,0.9704890387858347,2025-04-28 17:07:12.675779,2025-04-28 17:07:15.394111,0 days 00:00:02.718332,0.01641322580239663,balanced,800,l1,0.0009646038971770051,COMPLETE
87,87,0.9727463312368974,2025-04-28 17:07:15.394443,2025-04-28 17:07:17.542669,0 days 00:00:02.148226,0.06317139433359652,balanced,700,l1,0.0038628298885816795,COMPLETE
88,88,0.9639677829588807,2025-04-28 17:07:17.543006,2025-04-28 17:07:19.693367,0 days 00:00:02.150361,0.0049228867545671835,balanced,900,l1,0.02001615945303769,COMPLETE
89,89,0.9730639730639731,2025-04-28 17:07:19.693698,2025-04-28 17:07:22.396238,0 days 00:00:02.702540,0.03421344790140155,,600,l1,0.00018062610802694096,COMPLETE
90,90,0.9735182849936949,2025-04-28 17:07:22.396572,2025-04-28 17:07:25.268661,0 days 00:00:02.872089,0.020551915049898884,balanced,1000,l1,0.0004069163454069271,COMPLETE
91,91,0.9735182849936949,2025-04-28 17:07:25.269001,2025-04-28 17:07:28.011020,0 days 00:00:02.742019,0.026299753946773273,balanced,800,l1,0.0006080289403945469,COMPLETE
92,92,0.9719077568134172,2025-04-28 17:07:28.011360,2025-04-28 17:07:30.377628,0 days 00:00:02.366268,0.1750903698974295,balanced,800,l1,0.0005409577404348491,COMPLETE
93,93,0.9715004191114837,2025-04-28 17:07:30.378159,2025-04-28 17:07:32.584468,0 days 00:00:02.206309,0.10403353671350034,balanced,900,l1,0.001329153122351433,COMPLETE
94,94,0.9700548291859974,2025-04-28 17:07:32.584828,2025-04-28 17:07:36.126179,0 days 00:00:03.541351,0.012424063171020834,balanced,800,l1,0.0003003301593622443,COMPLETE
95,95,0.973109243697479,2025-04-28 17:07:36.126518,2025-04-28 17:07:38.793900,0 days 00:00:02.667382,0.036291850216436605,balanced,700,l1,0.00025768091759345937,COMPLETE
96,96,0.9731543624161074,2025-04-28 17:07:38.794241,2025-04-28 17:07:41.477213,0 days 00:00:02.682972,0.05314567906656485,balanced,800,l1,0.0004420368256272817,COMPLETE
97,97,0.9649641198818066,2025-04-28 17:07:41.477547,2025-04-28 17:07:44.719831,0 days 00:00:03.242284,0.021262329794735704,balanced,900,l2,0.0010192701069049895,COMPLETE
98,98,0.966567922132882,2025-04-28 17:07:44.720181,2025-04-28 17:07:48.800086,0 days 00:00:04.079905,0.00926121182362691,balanced,800,l1,0.00022216937973109635,COMPLETE
99,99,0.9731543624161074,2025-04-28 17:07:48.800419,2025-04-28 17:07:51.200064,0 days 00:00:02.399645,0.07192590554282359,balanced,500,l1,0.0006387080744902231,COMPLETE
